product_name,product_description,product_domain
Chiratae Ventures,A leading tech venture capital fund focused on enabling entrepreneurs in India.,Venture capital
MedLife,"An India online platform, which provides pharmacy, diagnostics, and e-consultation in India.",Health
IDfy,IDfy provides risk and fraud solutions,IT
True Balance,Earn money by meeting financial needs of your friends and neighbors.,Finance
Bira91,A craft beer brand manufactured by B9 Beverages Pvt. Ltd.,Craft Beer
Max wholesale,MaxWholesale is an online distributor that provides authentic FMCG goods,E-commerce
Craftsvilla,"Sells ethnic apparel, footwear, fashion accessories, beauty products, handcrafted home accessories",E-commerce
MechMocha,India's first vernacular social gaming platform,Entertainment
Mindhouse,A gym to train your mind offering workouts and programmes,Healthtech
DeepSync,"A revolutionary way to record your content, without you really speaking",AI startup
Eruditus,Bring world-class business and professional education to a global audience,Education
Gradeup,"India's largest exam preparation destination,",Education
Tracxn,Tracxn is the research partner for Venture Capitalist,Investment
Purple Style Labs,Shopping experience and foster the growth of Indian brands and designers.,Fashion
ProPhysio,The largest provider of physiotherapy and rehabilitation services,Health
Flickstree,World's largest video publisher,Tech
Settl,Get affordable AC bus-rides everyday,TravelTech
Fanspole,India's only social fantasy gaming platform,Entertainment
Sarva,A wellness ecosystem built on the authentic foundations of Yoga,Healthcare
Univ.ai,"A distributed, global educational powerhouse that draws on technology",EdTech
PurohitJi,App for Hindu Puja Products & Services,Linguistic Spiritual
CredoLab,AI credit scoring platform,Tech
Brick&Bolt,"A construction company doing house construction, building construction, commercial construction",Construction
Grinntech,Leading on all fronts of battery design,Battery manufacturer
6Degree,India's leading fashion business platform,Fashion
Exprs,"Nano Distribution Centres, enabling seamless connectivity of businesses & Consumers.",Nano Distribution Network
Bikayi,Provides free whatsapp integrated E-Commerce Store,E-commerce
Virtual Forest,Tracking seasonal change in virtual forest,Tech
The Health company,Organic superfoods & free personal health coaching that actually work.,AI health
TrulyMadly Matchmakers,One of the best dating Apps in India connecting singles across the country.,Dating app
TrueFan,Enables users to play quizzes around celebrities and winners get a personalised video message from stars.,Media
Fanspole,A free app that users can use to create contests and play,Gaming
Byju's,Provides online learning classes,EdTech
Avail Finance,Instant online loan app,Fintech
The Money Club,AI based chit fund cashier app,AI
Virohan,Healthcare training company,Healthcare/Edtech
OneCode,Connects new-age digital first brands with relevant sellers,Social Commerce
Verloop.io,Helps automate customer service using Artificial Intelligence,AI
Otipy,Connects consumers with farmers thorugh women resellers,Agritech/Commerce
Evage,Develop emissions-free electric commercial vehicles,Mobility tech
LEAD School,Offers an integrated system for schools by helping them digitize the entire curriculum,EdTech
Trell,Allows users to share their travel experiences,Social e-commerce
Captain Fresh,Sea food Supply chain,Food & Logistics
Teachmint,Empowers tutors with tools to deliver effective learning outcomes for students and parents,EdTech
Pixxel,Indian Earth observation startup,SpaceTech
Habbit Health,Applies modern science for healthier life through proprietary foods & digital ecosystem,Nutrition Tech
SmarterBiz,An end-to-end CX platform enabled with the gig workforce,Tech
Able Jobs,Provides end to end hiring support to companies,HR
Vieroots,Personalised lifestyle management using epigenetic science,Healthtech
Stack Finance,"It automates invesments, expenses, borrowing under a single platform",Fintech
FPL Technologies,OneScore app is built by FPL - Free credit scoring and monitoring,Fintech
Masai School,It trains tech aspirants in full stack wed and android development,EdTech
Mitron,Short Video and Social Platform,Media
Daalchini,Physical and Digital vending machines startup,IoT
Suno India,Multilingual podcast platform,Media
LendingKart,Provides working capital loans and business loans to MSMEs,Fintech
Eden Smart Homes,Develops smart home automation systems,IoT
GrayQuest,Enables parents to pay their annual education fees in up to 12 monthly installments,EdTech
BigHaat,Agri-inputs ecommerce player,Agritech
CityCash,Focusses on creating a transit led micro-payments ecosystem,Fintech
HomeLane,Provides interior designing solutions,Interior design
HungerBox,"Offers B2B tech platform to corporates, aimed at improving the operations of their cafeterias",Foodtech
DaveAI,Sales augmentation platform with a vision to democratise AI for enterprises,AI
Eduvanz,Digital finance NBFC that provides affordable education loans,Fintech
ZipLoan,Provides loans to MSMEs,Fintech
DocSumo,Platform helps to automate and analyse financial data,AI
CUSMAT,It builds high immersion training systems for enterprises,AR/VR
Chingari,Short video platform,Media
Bolo Indya,User-generated content platform,Media
Data Sutram,Platform gathers intel from external data to provide location-based data intelligence.,AI
Wobot Intelligence,AI backed video analytics platform,AI
DrinkPrime,Subscription-based Water purifier startup,Appliance
Infeedo,An employee engagement HR analytics platform,HR tech
Probus Smart Things,Platform for monitoring distribution sub-station performance and operations,IoT
CrowdPouch,A reward-based fundraising and preselling platform,Tech
Rebel Foods,Cloud kitchen platform,Food tech
Hevo,Data pipeline startup,Tech
BigSpoon Foods,Cloud kitchen startup,Foodtech
Chingari,Homegrown short video platform,Media
ShareChat,Indian social network platform,Media
DatStop,It offers urban social space,Hospitality
IPHM Services,It helps design programs and workshops for the psychological well-being of individuals,Mental Health
Wellcure,It caters to all health and wellness needs,Healthtech
VilCart,"Retail industry in rural India through technology, supply chain, and logistics facilities.",Ecommerce
Firescore,Game development studio,Gaming
BulBul,A video and livestream led commerce platform that makes online shopping engaging,Social commerce
Toppr,It provides AI-based after school learning app for K12,Edtech
Pickright Technologies,Marketplace for stock market investors and advisors,Fintech
Muse Wearables,It sells the world’s first payment-enabled hybrid smartwatches,Tech
SATYA Microcapital,Microfinance company that offers collateral-free credit to micro enterprises,Fintech
WYN Studio,It creates video content and podcasts,Media
Fourth Partner Energy,Largest startup in the distributed solar sector,Solar Solution
Entri,Local language learning startup,Edtech
Snack Amor,Healthy snack startup,Foodtech
MPowered,Asset Management Solutions,SaaS
Leap Club,Community led professional network for women,Social e-commerce
Ather Energy,Electric scooter manufacturer,Automobile
Gigforce,Provides staffing solutions for businesses,HR tech
Vegrow,It is building an asset-light farm by partnering with small farms on a profit-sharing model,Agritech
Finn,Neobanking startup that digitises all banking transactions,Fintech
Bijnis,Provides a platform for manufacturers and retailers in digital transaction,B2B marketplace
iNurture,"It provides a conducive and healthy teaching, learning environment",Edtech
StyleDotMe,"mirrAR, helps jewellers sell jewellery with no physical inventory",Fashion Tech
Ripsey,It plans meals in consultation from fitness experts and nutritionists and prepares them in-house,Nutrition tech
ThriveFNC,Focusses on reversing chronic lifestyle disorders through functional nutrition.,Health & Wellness
Vedantu,Onine learning platform,Edtech
Procol,Commodity procurement platform,Agritech
Yumlane,Online retailer that offers a range of on-the-go hot snacking and meals,Cloud Kitchen
Crio,A learning platform for developers,Edtech
Openapp,Security solutions startup,IoT
PumPumPum,Offers leased car services,IoT/Automobile
uFony Services Pvt ltd,"School Diary, a platform that brings education to smartphones",Edtech
Protinus Fashion Networking Pvt Ltd,Owns and operates fashion commerce and retail management platform 6Degree,Fashion
Uable,Online life skills development platform for children,Edtech
ParkSmart,Parking spot reservation platform,IoT
Plum,Provides health benefits to corporates,Healthtech
IncNut Digital,Owns and Operates two women-centric digital media platforms -- Stylecraze.com and Momjunction.com,Ecommerce
GigIndia,Marketplace that provides on-demand work completion for companies through workforce of jobseekers,Tech
Specsmaker,Online optical chain for eye wears,Eye Wear
Piggy Ride,"Offers parents and kids, a platform to browse and book extracurricular interest-based activities",SaaS
Chai Waale,Tea Brand,Beverage
NOTO,A brand that makes healthy icecream,Food
Cuemath,It helps students to learn math online,Edtech
Cars24,Online platform for selling used cars,Automobile
JetSynthesys,Digital entertainment and technology company,Digital tech
Earth Energy EV,Electric vehicles startup,Automobile
Green Cure,It sells herbal OTC products,Health & Wellness
Blue Sky Analytics,"It is building AI-powered infrastructure to analyse air quality, pollution etc",Data Intelligence
Edhusk,Provieds personalised learning to students by leveraging technology-driven models,Edtech
Decentro,Automated API-based platform that enables financial integrations.,Fintech
Zolostays,It offers affordable housing apartments to young professionals and students,Co-living
Frontier Markets,Women entreprenuers sells products and services to rural India,Ecommerce
Brainwired,India’s first livestock health monitoring company,Agritech
Aye Finance,A finance lender to SMEs,Fintech
Paper Boat,Ecommerce platform for beverages and snacks,Food & Beverages
Ken42,A platform that caters to evolving needs of institutions,Edtech
Forbidden Foods,Packaged snacks company,Food
Universal Sportsbiz,Indian fashion industry with on-trend products,Fashion
Gobbly,A contactless retail store filled with fruits and veggies,Retail Tech
Aerostrovilos,Manufactures micro gas turbines for power-based application,Automotive
Mitron,Short Video and Social Platform,Media
Bulk MRO,A full stack B2B platform for industrial supplies,B2B
Inspektlabs,Focuses on building computer vision products for physical asset inspections,AI
Big Bang Boom Solutions,It developed integrated intellectual properties for defense,Defense tech
Flinto,It is an educational subscription-box focussed at activity-based learning for the ages 2-12,Edtech
Zetwerk,B2B marketplace that connects manufacturing companies for industrial equipements,Marketplace
ChitMonks,Offers enterprise private platform for chit fund firms,Fintech
Walrus,It provides banking solutions for teens and young adults,Fintech
Arth Designbuild,Construction technology and solutions provider,Construction tech
goDutch,Group Payments platform,Fintech
Rusk Media,It creates video content,Digital Media
Bold Care,Digital platform that offers sexologist consultations for  men,Health & Wellness
Samosa Party,Provides quality Indian Snacks,Food
High Street Essentials,The parent company of women's fashion brands FabAlley and Indya,Ecommerce
Byju's,Provides online learning classes,Edtech
Slice,A financial platform for youngsters,Fintech
Bombay Play,It designs and creates online multiplayer games,Gaming
Fullife,It sells sports nutrition supplements through a brand called Fast&Up,Healthtech
Oziva,Clean Label Active Nutrition Brand,Nutrition
Aye Finance,A finance lender to SMEs,Fintech
Aether Biomedical,"Medical robotics startup, focussed on developing rehabilitation devices",Medtech
91springboard,It offers collaborative workspace with varied amenities,Coworking
Yulu,The electric and scooter rental startup,Micro-mobiity
Milkbasket,Hyperlocal delivery service startup,Logistics
MergerDomo,Global online corporate deal sourcing and consulting marketplace,Marketplace
GoMechanic,Find automobile repair and maintenance service providers,Auto-tech
Milk Mantra,Produces Dairy Products,Food
Myglamm,On-demand beauty services provider,Beauty
Drishti Technologies,"AI-based video analytics, data, and insights bring benefits to manufacturers",AI
Instasolv,It is a doubt-solving app for students from Class 6 to 12,Edtech
GoldenPi,An online aggregator of bonds and debentures available in the secondary market,Fintech
Peppermint,Industrial robotics startup,Robotics
Sarva,It drives a cultural change in making yoga-based wellness a part of modern lifestyle,Yoga & wellness
Jai Kisan,A platform that caters the need of customers in rural areas,Fintech
Agro2o,It develops products focused on making hydroponics-based farming,Agritech
LetsTransport,Offers techno logistics solutions,Logitech
GabbarDeals,Online-to-Offline platforms for mobile phones & accessories,Ecommerce
Crimson Healthcare,It innovates cutting edge solutions for various problems in the healthcare system,Med Tech
Biomoneta,It develops germicidal technologies,Life sciences
Edvizo,"Online marketplace to search, compare and enrol in the best institutes for competitive exam preparation",Edtech
Servify,Operates device management and support platform,SaaS
Drum Food,It runs yoghurt brand Epigamia,Food
Innoviti,Digital payments solutions company,SaaS
Jiffy ai,Enterprise automation startup,AI
Postman,API development platform startup,Tech
F5,It provides opportunities for its partner vendors to upsell and cross-sell their products.,Retail Aggregator
Waycool,Food development and distribution services,Agritech
Myelin Foundry,"It builds AI based algorithms on video, voice and sensor",Deep Tech AI
Ameliorate Biotech,"Their products address the needs in Early Stage Diagnostics, Bio-Similars and Nutraceuticals.",Biotech
Hapramp,Startup working on technologies like blockchain and social media,Blockchain
MyKaam,Online job searching and recruiting platform,HrTech
HealthPlix,It provides clinical software for doctors,Healthtech
YoloBus,Intercity bus service startup,Mobility/Transport
iNurture Education,"It provides a conducive and healthy teaching, learning environment",Edtech
Pocket52,An online poker playing platform,Gaming
QuaQua,Virtual travel guide platform,Travel
Crofarm,Supply chain that supports farmers and provides businesses with freshest produce,Agritech
Timios,Provides healthy snacks for kids,Foodtech
Wooden Street,It enables to order custom furniture online,Ecommerce
BankBazaar,Online marketplace that gives customers instant customised offers on loans and credit cards,Fintech
Rentmojo,"Rental platform for furniture, appliances & electronics",Rental
Credgencies,Tech-enabled platform for resolution of non-performing assets,AI & Debt
Knorish,All-in-one knowledge commerce SaaS platform,SaaS/Edtech
LetsTransport,Offers techno logistics solutions,Logitech
Vahak,It enables logistic companies to conncet with transporters,Transport
Nutrova,"Nutraceutical company developing evidence-based nutrition and nutraceutical products,",Nutrition
Cube Wealth,A digital wealth management services,SaaS
IVF Access,It provdes IVF treatments,Healthtech
Hoi Foods,Quality food solution,Foodtech
Ola Financial Services,It operates Ola Money,Fintech
Awifs,Provides office space solutions,Co-working
Dunzo,India-based hyperlocal delivery startup,Logistics
Swiflearn,Learning platform for K-10 students looking for personalised learning,Edtech
Remedo,The platform connects doctors with patients,Healthtech
Blowhorn,Tech platform that connects logistics service seekers with mini-truck drivers,Logistics
Toch,"Helps online video creators, media companies, advertisers, and OTT platforms optimise their videos",AI
Gram Cover,It provides insurance products in rural areas,Insurtech
Coin DCX,Hybrid crypto exchange platform,Cryptocurrency
HomeCapital,Home Down Payment Assistance Program,Fintech
Euler Motors,Startup focusses on electric vehicles,Automotive tech
Riskcovry,Offers various insurance products,Insurtech
NWNT (No Worry No Tension Healthcare),Mental healthtech startup,Healthtech
Voicezen,Conversational AI startup,AI
Credit Mantri,Offers free credit score and a detailed credit analysis report,Fintech
Xtracap,"Offers online payment solution,schemes, order management, insurance etc.,",Fintech
Tring,Celebrity engagement platform,Media
Vakilsearch,"Online platform for legal, tax and compliance services",Legal
Khatabook,It helps SMEs to maintain their accounts and ledger online.,Fintech
LendingKart,Provides working capital loans and business loans to MSMEs,Fintech
Illumnus,Offers Collaborative learning management system for educational institutions,Edtech
LetsTransport,Offers techno logistics solutions,Logitech
Eggoz,"Provides technology backed, deep integration services to egg farmers",Agritech
Winuall,It helps coaching institutes in digitization,Edtech
Indian School Finance Company,NBFC that provides funding to education system,Fintech
DeepTek,AI enabled radiology platform,Healthtech
Stepathlon Lifestyle,It organises corporate wellness programs,Fitness
Sindhuja Microcredit,It provides financial services to self employed women entrepreneurs,Fintech
Rentmojo,"Rental platform for furniture, appliances & electronics",Rental
Tesco Charge Zone,Operates electric vehicle charging zone,EV
Intello Labs,Standardisation and Quality control of fruits & vegetables,"Supply chain, Agritech"
SirionLabs,"Provides procurement, outsourcing services & contract management software",SaaS
GroCurv,"It offers a wide range of business related services like Branding, marketing, sales etc.,",B2B
Refrens,"Offers a free invoicing, payments and expense management system",SaaS
Shiprocket,Tech enabled logistics aggregator,Logitech
Spyne,Helps online businesses with visual content,AI
Nykaa,Deals in cosmetic and wellness products,Ecommerce
Docsapp,Online doctor consultation app,Healthtech
Phable,"It creates an engagement loop between doctors, hospitals, and patients via its app",Healthtech
Generic Aadhaar,It provides a platform for entrepreneurs to access generic  medicine at low cost,Pharma
Nium,Open global money platform,Fintech
Mintoak,Merchant payment solutions startup,Fintech
VestSpace,It builds small satellite paltforms,Spacetech
Blackbuck,Provides trucking services,Logistics
Vernacular ai,It offers Multiligual AI platform,AI
Clover,Provides agricultural solution to farmers working in the greenhouse production of vegetables and fruits,Agritech
Varthana,Offers secured and unsecured loans,Fintech
Codeninja,AI-powered 'no-code' platform which can generate application development code,SaaS
MetaMerphoSys,Digital insurance platform for businesses,Insurance technology
Rooter,Live sports engagement platform,Gaming
Aker Foods,Ai driven supply chain platform,Foodtech & Logistics
Sascan Meditech pvt ltd,They are developing technology that can detect early cancerous cells,Healthtech
DailyHunt,News aggregator,Media
Pratilipi,A digital platform that connects readers and writers in various languages,Media
Biryani By Kilo,Online paltform to order biryani,Food
Consure Medical,"Novel platform technologies to manage, diagnose, and treat various GI disorders",Healthtech
Tessol,It provides end to end cold chain logistics solutions,Logistics
Remedo,"It helps doctors engage with patients, improve patient experience",Healthtech
News Reach,"It is a platform that digitalises local newspaper publishers, reporters, stringers by aggregating their content",Media
RoomSoom,It provides co-living and student rooms,Housing
Pedagogy,It has a single subscription model that allows users to access books and digital courses.,Edtech
Classplus,"It provides mobile-first software for coaching institutes, tuition centres and private tutors",Edtech
Medlife,It solves inadequacies in the healthcare delivery system through technology,Pharmaceutical
Qin1,It is alearning platform for kids in the age group 5 to 14 yrs,Edtech
MYSUN,Platform for rooftop solar energy solutions,Tech
ShopX,B2B retail operating system,Ecommerce
Sarva,It drives a cultural change in making yoga-based wellness a part of modern lifestyle,Yoga & wellness
Expertrons,AI video bot platform for career hacks,AI
NewsBytes,News portal,Digital Media
NIRA,It offers access and credit to working Indians,Fintech
Convosight,It helps business gain insights from its community on Facebook groups,Data Analytics
Fittr,Fitness Social Network & Consultation Platform,Fitness
AsknBid,It builds algorithmic investing-based tech products,Investment Tech
Bira91,Craft beer maker,Beverage
Finaureus Technologies,Provides investment management solutions,Fintech
Daily Ninja,Online Milk Delivery startup,Ecommerce
Guvi Geek Network Pvt Ltd,Operates vernacular-language based education,Edtech
LoadShare,Provides technology based solutions to SMEs in logistics,Logistics
Vedantu,Onine learning platform,Edtech
Indusface,It provides IT security solutions,IT
DMI Group,Pan-India Credit providing platform,Financial Services
Spintly,It is a wireless cloud-based access control system,IoT
Credr,A marketplace to buy and sell used bikes and scooters,Automobile
Bijak,"It is a platform that gives agricultural commodity at better prices, increased working capital, and optimised logistics",Agritech
Bugworks,A drug discovery company that aims to discover novel treatment options for resistant bacterial infections,Biopharma
Yap,Banking and payment products-focused API platform,Fintech
UzhavarBumi,Provides fresh dairy products,Dairy
Tattva,Sells its organic and beauty products via marketplace,Beauty & wellness
Pariksha,Platform for vernacular test-preparation,Edtech
DailyHunt,News aggregator,Media
NoBroker,Online real estate rental startup,Real Estate
Box8,Enables to order food online,Foodtech
Capital Float,Online platform that provides working capital finance to SMEs,Fintech
ITILITE,Platform for business travel,Travel & SaaS
Morning Context,A subscription-only digital media publisher,Digital Media
Aavenir,Source-to-Pay Software,SaaS
Savvy Co op,It connects patients with healthcare companies,Healthcare
BLive,"It offers experiential, guided tours on smart electric bikes",Tourism & EV
Yellow Messenger,It offers conversational chatbots,AI
Toch,AI based Video object detection and Tagging platform,Media Tech
Ewar,E-sports and real-time gaming startup,Gaming
Setu,"Offers open APIs across four categories: bills, savings, credit, and payments.",Fintech
Wellthy Therapeutics,It offers a digital therapeutics service,Healthtech
Power Gummies,Offers health supplements related gummies,Health
Locale ai,It helps companies with moving assets  increase revenues and demand using real time location data and analytics,Location Analytics
FarEye,"It enables businesses to execute, track, predict and oprimize the movements of goods",Logistics
Rebel Foods,It runs internet kitchen,Food tech
BankBazaar,Online marketplace that gives customers instant customised offers on loans and credit cards,Fintech
Porter,Logistics and fleet management,Logistics
SugarBox,Hyperlocal data distribution platform,Tech
Capital Float,Online platform that provides working capital finance to SMEs,Fintech
Big Basket,Online grocery store,E store
Amica,Neobanking startup,Fintech
Vedantu,Onine learning platform,Edtech
Fingerlix,"It provides ready-to-cook products such as batters, mixes, curries, dals, parathas etc.,",Food
Plop,It Provides an interactive fiction entertainment platform to entertain & educate Gen Z & Millennials in a language they understand,Tech
Zupee,It runs live quiz tournaments on its app.,Gaming
DeHaat,Online marketplace for farming services and products,Agritech
Lido Learning,Online teaching service,Edtech
Aye Finance,A finance lender to SMEs,Fintech
Swiggy,Platform to order food online from restaurants and getting it delievered,Foodtech
Akna Medical,Provides supply solutions for surgical and pharmaceutical products.,Healthtech
Zomato,Online food delivery and restaurant discovery platform,Foodtech
RaRa Delivery,Provides same day delivery service for ecommerce businesses,Logistics
JusPay,Online payment solutions,Fintech
Obviously AI,It provides predictive insights to clients by leveraging their data,Data Science
Fingpay,Provides payment solutions,Fintech
Recko,The platform enables AI-powered reconciliation of digital transactions,SaaS
Furlenco,Furniture rental startup,Ecommerce
Mera Cashier,App meant for small and micro businessmen to manage their transactions digitally,Fintech
Camp K12,It connects students with tutors online,Edtech
MedGenome,Genetic diagnostic testing company,Healthtech
Ergos,It enables farmers to digitise their foodgrain and also provide access to supply chain solutions,Agritech
Nykaa,Deals in cosmetic and wellness products,Ecommerce
Samadhan,They help find solutions to insurance related issues,Insurance
SaScan,Cancer diagnostics startup,Healthcare
Lido Learning,Online teaching service,Edtech
CureFit,"Integrated platform for food, fitness and meditation.",Health and Fitness
Nimesa,Cloud data managemnt solutions enterprise,SaaS
Design X,Builds IoT based products,IoT
Driftly Electric,Electric vehicle startup,Automobile
Imstrong,It is an online and live video-streaming platform that allows trainers and fitness enthusiasts to connect and engage in interactive online classes.,Fitness
Craftsvilla,Online marketplace for ethnic wear,Marketplace
Rupifi,Offers financial products for SMEs,Fintech
SnackAmor,It offers various healthy snacks,Food
Zealthy,"It connects women to healthproviders for specialities like infertility, maternity etc.,",Healthtech
CoinDCX,A cryptocurrency trading platform,Fintech
NuNu TV,Kids-focussed Youtube channel,Media
QTalk,Smart Phone Dialer,Technology
Shadez,Paint Company,Interior & decor
