product_name,product_domain,product_description
PersonalizedAnalytics,E-commerce,"A Personalized way to innovate E-commerce. PersonalizedAnalytics revolutionizes E-commerce with Personalized Analytics. Tailored for Gamers, it ensures seamless interaction, advanced security, and insightful data to drive decisions."
Data-DrivenLabs,PetTech,"An Data-Driven platform revolutionizing PetTech. Data-DrivenLabs revolutionizes PetTech with Data-Driven Labs. Tailored for Environmentalists, it ensures seamless interaction, advanced security, and insightful data to drive decisions."
On-DemandSolutions,PropTech,"A On-Demand Solutions for PropTech needs. On-DemandSolutions revolutionizes PropTech with On-Demand Solutions. Tailored for Parents, it ensures seamless interaction, advanced security, and insightful data to drive decisions."
PersonalizedWorks,TravelTech,"An Personalized platform revolutionizing TravelTech. PersonalizedWorks revolutionizes TravelTech with Personalized Works. Tailored for Fitness Enthusiasts, it ensures seamless interaction, advanced security, and insightful data to drive decisions."
AutomatedSphere,AgriTech,"A Automated Sphere connecting Retailers in AgriTech. At AutomatedSphere, we deliver Automated Sphere that reshapes AgriTech experiences. Our Big Data-enabled platform empowers Retailers to achieve better outcomes, faster and smarter."
IntelligentSystems,EdTech,"An Intelligent platform revolutionizing EdTech. IntelligentSystems is a Intelligent Systems designed specifically for Startups. By leveraging IoT Systems, it transforms how EdTech operates. Users enjoy an intuitive interface, powerful analytics, and scalable solutions."
NextGenExchange,E-commerce,"An NextGen platform revolutionizing E-commerce. NextGenExchange is a NextGen Exchange designed specifically for Pet Owners. By leveraging Blockchain Technology, it transforms how E-commerce operates. Users enjoy an intuitive interface, powerful analytics, and scalable solutions."
VirtualCloud,HealthTech,"A Virtual way to innovate HealthTech. At VirtualCloud, we deliver Virtual Cloud that reshapes HealthTech experiences. Our 5G Networks-enabled platform empowers Travel Enthusiasts to achieve better outcomes, faster and smarter."
On-DemandPlatform,Remote Work Solutions,"A On-Demand solution for Developers in Remote Work Solutions. At On-DemandPlatform, we deliver On-Demand Platform that reshapes Remote Work Solutions experiences. Our Blockchain Technology-enabled platform empowers Developers to achieve better outcomes, faster and smarter."
SmartHub,Mental Health,"A Smart Hub for Mental Health needs. SmartHub revolutionizes Mental Health with Smart Hub. Tailored for Researchers, it ensures seamless interaction, advanced security, and insightful data to drive decisions."
SecureCore,TravelTech,"A Secure solution for Gamers in TravelTech. At SecureCore, we deliver Secure Core that reshapes TravelTech experiences. Our Cybersecurity Innovations-enabled platform empowers Gamers to achieve better outcomes, faster and smarter."
AffordableHub,E-commerce,"A Affordable way to innovate E-commerce. AffordableHub brings Affordable Hub to E-commerce. Serving Artists, we ensure efficiency, affordability, and unmatched innovation through Cloud Computing technology."
VirtualNest,Remote Work Solutions,"A Virtual solution for Investors in Remote Work Solutions. VirtualNest revolutionizes Remote Work Solutions with Virtual Nest. Tailored for Investors, it ensures seamless interaction, advanced security, and insightful data to drive decisions."
AutomatedSolutions,Cybersecurity,"A Automated way to innovate Cybersecurity. AutomatedSolutions revolutionizes Cybersecurity with Automated Solutions. Tailored for Small Businesses, it ensures seamless interaction, advanced security, and insightful data to drive decisions."
SustainableMarketplace,EdTech,"A Sustainable Marketplace connecting Investors in EdTech. SustainableMarketplace is a Sustainable Marketplace designed specifically for Investors. By leveraging Cloud Computing, it transforms how EdTech operates. Users enjoy an intuitive interface, powerful analytics, and scalable solutions."
IntelligentPulse,HealthTech,"A Intelligent solution for Students in HealthTech. At IntelligentPulse, we deliver Intelligent Pulse that reshapes HealthTech experiences. Our AI and Machine Learning-enabled platform empowers Students to achieve better outcomes, faster and smarter."
CollaborativeLabs,Gaming,"A Collaborative solution for Retailers in Gaming. At CollaborativeLabs, we deliver Collaborative Labs that reshapes Gaming experiences. Our 5G Networks-enabled platform empowers Retailers to achieve better outcomes, faster and smarter."
CollaborativePulse,Cybersecurity,"An Collaborative platform revolutionizing Cybersecurity. CollaborativePulse is a Collaborative Pulse designed specifically for Healthcare Providers. By leveraging Cybersecurity Innovations, it transforms how Cybersecurity operates. Users enjoy an intuitive interface, powerful analytics, and scalable solutions."
SecureLabs,TravelTech,"A Secure way to innovate TravelTech. SecureLabs is a Secure Labs designed specifically for Retailers. By leveraging 5G Networks, it transforms how TravelTech operates. Users enjoy an intuitive interface, powerful analytics, and scalable solutions."
AffordableSolutions,Cybersecurity,"A Affordable Solutions for Cybersecurity needs. AffordableSolutions revolutionizes Cybersecurity with Affordable Solutions. Tailored for Startups, it ensures seamless interaction, advanced security, and insightful data to drive decisions."
AutomatedNest,GreenTech,"A Automated solution for Researchers in GreenTech. AutomatedNest brings Automated Nest to GreenTech. Serving Researchers, we ensure efficiency, affordability, and unmatched innovation through Blockchain Technology technology."
SecureExchange,TravelTech,"A Secure Exchange connecting Pet Owners in TravelTech. SecureExchange brings Secure Exchange to TravelTech. Serving Pet Owners, we ensure efficiency, affordability, and unmatched innovation through Blockchain Technology technology."
SecureLabs,HealthTech,"A Secure Labs for HealthTech needs. SecureLabs revolutionizes HealthTech with Secure Labs. Tailored for Healthcare Providers, it ensures seamless interaction, advanced security, and insightful data to drive decisions."
