product_name,product_domain,product_description
PersonalizedHub,HealthTech,"A Personalized Hub for HealthTech needs. PersonalizedHub is a Personalized Hub designed specifically for Developers. By leveraging Big Data, it transforms how HealthTech operates. Users enjoy an intuitive interface, powerful analytics, and scalable solutions."
IntelligentFramework,TravelTech,"A Intelligent solution for Healthcare Providers in TravelTech. IntelligentFramework is a Intelligent Framework designed specifically for Healthcare Providers. By leveraging Cybersecurity Innovations, it transforms how TravelTech operates. Users enjoy an intuitive interface, powerful analytics, and scalable solutions."
VirtualLabs,SaaS,"A Virtual solution for Freelancers in SaaS. VirtualLabs is a Virtual Labs designed specifically for Freelancers. By leveraging Blockchain Technology, it transforms how SaaS operates. Users enjoy an intuitive interface, powerful analytics, and scalable solutions."
IntelligentAssistant,Gaming,"A Intelligent Assistant for Gaming needs. IntelligentAssistant is a Intelligent Assistant designed specifically for Researchers. By leveraging 5G Networks, it transforms how Gaming operates. Users enjoy an intuitive interface, powerful analytics, and scalable solutions."
NextGenExchange,FirstCure Health aims to simplify the surgery experience by bringing the best surgeons with modern and safe procedures at affordable costs,
,000,"A NextGen way to innovate E-commerce. NextGenExchange brings NextGen Exchange to E-commerce. Serving Startups, we ensure efficiency, affordability, and unmatched innovation through Blockchain Technology technology."
SmartFramework,Gaming,"A Smart way to innovate Gaming. SmartFramework revolutionizes Gaming with Smart Framework. Tailored for Elderly, it ensures seamless interaction, advanced security, and insightful data to drive decisions."
InteractiveEngine,TravelTech,"A Interactive solution for Remote Workers in TravelTech. InteractiveEngine brings Interactive Engine to TravelTech. Serving Remote Workers, we ensure efficiency, affordability, and unmatched innovation through IoT Systems technology."
CollaborativeSphere,Mental Health,"A Collaborative way to innovate Mental Health. CollaborativeSphere is a Collaborative Sphere designed specifically for Pet Owners. By leveraging IoT Systems, it transforms how Mental Health operates. Users enjoy an intuitive interface, powerful analytics, and scalable solutions."
AffordableNetwork,Blockchain,"A Affordable Network connecting Gamers in Blockchain. AffordableNetwork brings Affordable Network to Blockchain. Serving Gamers, we ensure efficiency, affordability, and unmatched innovation through Big Data technology."
AffordableHub,Gaming,"A Affordable way to innovate Gaming. AffordableHub brings Affordable Hub to Gaming. Serving Elderly, we ensure efficiency, affordability, and unmatched innovation through IoT Systems technology."
NextGenCore,E-commerce,"An NextGen platform revolutionizing E-commerce. At NextGenCore, we deliver NextGen Core that reshapes E-commerce experiences. Our Cybersecurity Innovations-enabled platform empowers Parents to achieve better outcomes, faster and smarter."
AutomatedNest,AgriTech,"An Automated platform revolutionizing AgriTech. At AutomatedNest, we deliver Automated Nest that reshapes AgriTech experiences. Our Augmented Reality-enabled platform empowers Healthcare Providers to achieve better outcomes, faster and smarter."
Data-DrivenAnalytics,Cybersecurity,"A Data-Driven Analytics connecting Remote Workers in Cybersecurity. Data-DrivenAnalytics is a Data-Driven Analytics designed specifically for Remote Workers. By leveraging AI and Machine Learning, it transforms how Cybersecurity operates. Users enjoy an intuitive interface, powerful analytics, and scalable solutions."
DecentralizedAssistant,PetTech,"A Decentralized Assistant for PetTech needs. DecentralizedAssistant revolutionizes PetTech with Decentralized Assistant. Tailored for Freelancers, it ensures seamless interaction, advanced security, and insightful data to drive decisions."
AutomatedSolutions,Fitness,"A Automated Solutions for Fitness needs. At AutomatedSolutions, we deliver Automated Solutions that reshapes Fitness experiences. Our Blockchain Technology-enabled platform empowers Freelancers to achieve better outcomes, faster and smarter."
AffordableWorks,E-commerce,"A Affordable solution for Teachers in E-commerce. AffordableWorks brings Affordable Works to E-commerce. Serving Teachers, we ensure efficiency, affordability, and unmatched innovation through Blockchain Technology technology."
SmartAssistant,Wearable Tech,"A Smart way to innovate Wearable Tech. At SmartAssistant, we deliver Smart Assistant that reshapes Wearable Tech experiences. Our AI and Machine Learning-enabled platform empowers Pet Owners to achieve better outcomes, faster and smarter."
CollaborativeSolutions,Mental Health,"An Collaborative platform revolutionizing Mental Health. CollaborativeSolutions brings Collaborative Solutions to Mental Health. Serving Environmentalists, we ensure efficiency, affordability, and unmatched innovation through AI and Machine Learning technology."
SmartFramework,Mental Health,"A Smart solution for Developers in Mental Health. At SmartFramework, we deliver Smart Framework that reshapes Mental Health experiences. Our Augmented Reality-enabled platform empowers Developers to achieve better outcomes, faster and smarter."
PersonalizedAnalytics,EdTech,"A Personalized Analytics for EdTech needs. PersonalizedAnalytics revolutionizes EdTech with Personalized Analytics. Tailored for Investors, it ensures seamless interaction, advanced security, and insightful data to drive decisions."
VirtualNetwork,HealthTech,"A Virtual Network for HealthTech needs. At VirtualNetwork, we deliver Virtual Network that reshapes HealthTech experiences. Our Predictive Analytics-enabled platform empowers Travel Enthusiasts to achieve better outcomes, faster and smarter."
NextGenAssistant,GreenTech,"A NextGen solution for Fitness Enthusiasts in GreenTech. NextGenAssistant revolutionizes GreenTech with NextGen Assistant. Tailored for Fitness Enthusiasts, it ensures seamless interaction, advanced security, and insightful data to drive decisions."
NextGenSolutions,TravelTech,"A NextGen solution for Remote Workers in TravelTech. At NextGenSolutions, we deliver NextGen Solutions that reshapes TravelTech experiences. Our AI and Machine Learning-enabled platform empowers Remote Workers to achieve better outcomes, faster and smarter."
NextGenExchange,GreenTech,"A NextGen way to innovate GreenTech. At NextGenExchange, we deliver NextGen Exchange that reshapes GreenTech experiences. Our Cybersecurity Innovations-enabled platform empowers Artists to achieve better outcomes, faster and smarter."
CollaborativeCloud,FinTech,"A Collaborative way to innovate FinTech. At CollaborativeCloud, we deliver Collaborative Cloud that reshapes FinTech experiences. Our 5G Networks-enabled platform empowers Healthcare Providers to achieve better outcomes, faster and smarter."
DecentralizedMarketplace,RetailTech,"A Decentralized Marketplace connecting Teachers in RetailTech. DecentralizedMarketplace is a Decentralized Marketplace designed specifically for Teachers. By leveraging Predictive Analytics, it transforms how RetailTech operates. Users enjoy an intuitive interface, powerful analytics, and scalable solutions."
AutomatedSolutions,FinTech,"A Automated solution for Retailers in FinTech. AutomatedSolutions revolutionizes FinTech with Automated Solutions. Tailored for Retailers, it ensures seamless interaction, advanced security, and insightful data to drive decisions."
AI-poweredStudio,Gaming,"A AI-powered Studio connecting Freelancers in Gaming. AI-poweredStudio brings AI-powered Studio to Gaming. Serving Freelancers, we ensure efficiency, affordability, and unmatched innovation through 5G Networks technology."
DecentralizedSystems,AI & ML,"An Decentralized platform revolutionizing AI & ML. DecentralizedSystems brings Decentralized Systems to AI & ML. Serving Startups, we ensure efficiency, affordability, and unmatched innovation through Predictive Analytics technology."
AffordablePlatform,Mental Health,"An Affordable platform revolutionizing Mental Health. AffordablePlatform is a Affordable Platform designed specifically for Travel Enthusiasts. By leveraging AI and Machine Learning, it transforms how Mental Health operates. Users enjoy an intuitive interface, powerful analytics, and scalable solutions."
NextGenPlatform,TravelTech,"An NextGen platform revolutionizing TravelTech. NextGenPlatform revolutionizes TravelTech with NextGen Platform. Tailored for Startups, it ensures seamless interaction, advanced security, and insightful data to drive decisions."
IntelligentStudio,Wearable Tech,"A Intelligent way to innovate Wearable Tech. At IntelligentStudio, we deliver Intelligent Studio that reshapes Wearable Tech experiences. Our Cloud Computing-enabled platform empowers Pet Owners to achieve better outcomes, faster and smarter."
SustainablePulse,HealthTech,"A Sustainable way to innovate HealthTech. SustainablePulse brings Sustainable Pulse to HealthTech. Serving Investors, we ensure efficiency, affordability, and unmatched innovation through Edge Computing technology."
PersonalizedLabs,PetTech,"A Personalized Labs for PetTech needs. At PersonalizedLabs, we deliver Personalized Labs that reshapes PetTech experiences. Our Predictive Analytics-enabled platform empowers Pet Owners to achieve better outcomes, faster and smarter."
VirtualStudio,Wearable Tech,"A Virtual solution for Parents in Wearable Tech. At VirtualStudio, we deliver Virtual Studio that reshapes Wearable Tech experiences. Our IoT Systems-enabled platform empowers Parents to achieve better outcomes, faster and smarter."
On-DemandGrid,RetailTech,"A On-Demand way to innovate RetailTech. On-DemandGrid is a On-Demand Grid designed specifically for Small Businesses. By leveraging Augmented Reality, it transforms how RetailTech operates. Users enjoy an intuitive interface, powerful analytics, and scalable solutions."
VirtualGrid,HealthTech,"A Virtual Grid connecting Elderly in HealthTech. VirtualGrid is a Virtual Grid designed specifically for Elderly. By leveraging Edge Computing, it transforms how HealthTech operates. Users enjoy an intuitive interface, powerful analytics, and scalable solutions."
SecureFramework,PetTech,"A Secure solution for Remote Workers in PetTech. SecureFramework revolutionizes PetTech with Secure Framework. Tailored for Remote Workers, it ensures seamless interaction, advanced security, and insightful data to drive decisions."
SmartSolutions,Fitness,"A Smart Solutions connecting Researchers in Fitness. SmartSolutions is a Smart Solutions designed specifically for Researchers. By leveraging Edge Computing, it transforms how Fitness operates. Users enjoy an intuitive interface, powerful analytics, and scalable solutions."
Data-DrivenFramework,Fitness,"A Data-Driven Framework connecting Fitness Enthusiasts in Fitness. At Data-DrivenFramework, we deliver Data-Driven Framework that reshapes Fitness experiences. Our Predictive Analytics-enabled platform empowers Fitness Enthusiasts to achieve better outcomes, faster and smarter."
DecentralizedMarketplace,Wearable Tech,"A Decentralized Marketplace connecting Artists in Wearable Tech. DecentralizedMarketplace revolutionizes Wearable Tech with Decentralized Marketplace. Tailored for Artists, it ensures seamless interaction, advanced security, and insightful data to drive decisions."
On-DemandNetwork,AgriTech,"A On-Demand Network for AgriTech needs. On-DemandNetwork is a On-Demand Network designed specifically for Researchers. By leveraging Big Data, it transforms how AgriTech operates. Users enjoy an intuitive interface, powerful analytics, and scalable solutions."
AutomatedAssistant,FoodTech,"A Automated way to innovate FoodTech. AutomatedAssistant brings Automated Assistant to FoodTech. Serving Students, we ensure efficiency, affordability, and unmatched innovation through 5G Networks technology."
NextGenSystems,FinTech,"A NextGen Systems for FinTech needs. NextGenSystems is a NextGen Systems designed specifically for Remote Workers. By leveraging Cloud Computing, it transforms how FinTech operates. Users enjoy an intuitive interface, powerful analytics, and scalable solutions."
NextGenCloud,AI & ML,"A NextGen Cloud for AI & ML needs. NextGenCloud is a NextGen Cloud designed specifically for Fitness Enthusiasts. By leveraging Blockchain Technology, it transforms how AI & ML operates. Users enjoy an intuitive interface, powerful analytics, and scalable solutions."
AffordableFramework,E-commerce,"A Affordable Framework connecting Small Businesses in E-commerce. At AffordableFramework, we deliver Affordable Framework that reshapes E-commerce experiences. Our Edge Computing-enabled platform empowers Small Businesses to achieve better outcomes, faster and smarter."
SmartNest,GreenTech,"A Smart Nest for GreenTech needs. SmartNest brings Smart Nest to GreenTech. Serving Gamers, we ensure efficiency, affordability, and unmatched innovation through Cloud Computing technology."
InteractiveHub,PropTech,"A Interactive solution for Freelancers in PropTech. InteractiveHub revolutionizes PropTech with Interactive Hub. Tailored for Freelancers, it ensures seamless interaction, advanced security, and insightful data to drive decisions."
Data-DrivenNest,Wearable Tech,"A Data-Driven solution for Researchers in Wearable Tech. At Data-DrivenNest, we deliver Data-Driven Nest that reshapes Wearable Tech experiences. Our Edge Computing-enabled platform empowers Researchers to achieve better outcomes, faster and smarter."
SecureCore,TravelTech,"A Secure solution for Teachers in TravelTech. SecureCore is a Secure Core designed specifically for Teachers. By leveraging Predictive Analytics, it transforms how TravelTech operates. Users enjoy an intuitive interface, powerful analytics, and scalable solutions."
PersonalizedEngine,PropTech,"A Personalized way to innovate PropTech. PersonalizedEngine revolutionizes PropTech with Personalized Engine. Tailored for Nonprofits, it ensures seamless interaction, advanced security, and insightful data to drive decisions."
SmartMarketplace,FoodTech,"A Smart way to innovate FoodTech. SmartMarketplace revolutionizes FoodTech with Smart Marketplace. Tailored for Gamers, it ensures seamless interaction, advanced security, and insightful data to drive decisions."
AutomatedAssistant,FinTech,"A Automated Assistant connecting Environmentalists in FinTech. AutomatedAssistant is a Automated Assistant designed specifically for Environmentalists. By leveraging AI and Machine Learning, it transforms how FinTech operates. Users enjoy an intuitive interface, powerful analytics, and scalable solutions."
AffordableMarketplace,Remote Work Solutions,"A Affordable Marketplace for Remote Work Solutions needs. AffordableMarketplace revolutionizes Remote Work Solutions with Affordable Marketplace. Tailored for Elderly, it ensures seamless interaction, advanced security, and insightful data to drive decisions."
On-DemandExchange,FoodTech,"A On-Demand solution for Investors in FoodTech. At On-DemandExchange, we deliver On-Demand Exchange that reshapes FoodTech experiences. Our Augmented Reality-enabled platform empowers Investors to achieve better outcomes, faster and smarter."
VirtualAssistant,SaaS,"A Virtual Assistant connecting Artists in SaaS. VirtualAssistant brings Virtual Assistant to SaaS. Serving Artists, we ensure efficiency, affordability, and unmatched innovation through Augmented Reality technology."
IntelligentSolutions,Wearable Tech,"A Intelligent Solutions for Wearable Tech needs. IntelligentSolutions brings Intelligent Solutions to Wearable Tech. Serving Fitness Enthusiasts, we ensure efficiency, affordability, and unmatched innovation through Cloud Computing technology."
VirtualExchange,PropTech,"A Virtual solution for Nonprofits in PropTech. VirtualExchange brings Virtual Exchange to PropTech. Serving Nonprofits, we ensure efficiency, affordability, and unmatched innovation through Big Data technology."
IntelligentHub,Cybersecurity,"An Intelligent platform revolutionizing Cybersecurity. IntelligentHub revolutionizes Cybersecurity with Intelligent Hub. Tailored for Teachers, it ensures seamless interaction, advanced security, and insightful data to drive decisions."
InteractiveHub,FinTech,"A Interactive Hub for FinTech needs. InteractiveHub is a Interactive Hub designed specifically for Startups. By leveraging Edge Computing, it transforms how FinTech operates. Users enjoy an intuitive interface, powerful analytics, and scalable solutions."
InteractiveNest,Wearable Tech,"A Interactive Nest connecting Fitness Enthusiasts in Wearable Tech. InteractiveNest revolutionizes Wearable Tech with Interactive Nest. Tailored for Fitness Enthusiasts, it ensures seamless interaction, advanced security, and insightful data to drive decisions."
InteractiveCore,Wearable Tech,"A Interactive way to innovate Wearable Tech. InteractiveCore brings Interactive Core to Wearable Tech. Serving Artists, we ensure efficiency, affordability, and unmatched innovation through Edge Computing technology."
Data-DrivenWorks,PropTech,"A Data-Driven Works connecting Retailers in PropTech. Data-DrivenWorks is a Data-Driven Works designed specifically for Retailers. By leveraging Edge Computing, it transforms how PropTech operates. Users enjoy an intuitive interface, powerful analytics, and scalable solutions."
On-DemandHub,Cybersecurity,"A On-Demand way to innovate Cybersecurity. At On-DemandHub, we deliver On-Demand Hub that reshapes Cybersecurity experiences. Our Big Data-enabled platform empowers Travel Enthusiasts to achieve better outcomes, faster and smarter."
CollaborativeSolutions,PetTech,"A Collaborative way to innovate PetTech. CollaborativeSolutions brings Collaborative Solutions to PetTech. Serving Retailers, we ensure efficiency, affordability, and unmatched innovation through Cybersecurity Innovations technology."
SecureHub,Fitness,"An Secure platform revolutionizing Fitness. At SecureHub, we deliver Secure Hub that reshapes Fitness experiences. Our IoT Systems-enabled platform empowers Gamers to achieve better outcomes, faster and smarter."
SecureFramework,Cybersecurity,"An Secure platform revolutionizing Cybersecurity. SecureFramework revolutionizes Cybersecurity with Secure Framework. Tailored for Fitness Enthusiasts, it ensures seamless interaction, advanced security, and insightful data to drive decisions."
SustainableLabs,RetailTech,"A Sustainable way to innovate RetailTech. SustainableLabs brings Sustainable Labs to RetailTech. Serving Environmentalists, we ensure efficiency, affordability, and unmatched innovation through IoT Systems technology."
SecureSystems,FoodTech,"A Secure solution for Small Businesses in FoodTech. At SecureSystems, we deliver Secure Systems that reshapes FoodTech experiences. Our Edge Computing-enabled platform empowers Small Businesses to achieve better outcomes, faster and smarter."
SecureGrid,Cybersecurity,"An Secure platform revolutionizing Cybersecurity. At SecureGrid, we deliver Secure Grid that reshapes Cybersecurity experiences. Our 5G Networks-enabled platform empowers Researchers to achieve better outcomes, faster and smarter."
AutomatedExchange,PetTech,"An Automated platform revolutionizing PetTech. AutomatedExchange revolutionizes PetTech with Automated Exchange. Tailored for Researchers, it ensures seamless interaction, advanced security, and insightful data to drive decisions."
AffordableGrid,AgriTech,"An Affordable platform revolutionizing AgriTech. AffordableGrid is a Affordable Grid designed specifically for Healthcare Providers. By leveraging Blockchain Technology, it transforms how AgriTech operates. Users enjoy an intuitive interface, powerful analytics, and scalable solutions."
NextGenAnalytics,TravelTech,"An NextGen platform revolutionizing TravelTech. At NextGenAnalytics, we deliver NextGen Analytics that reshapes TravelTech experiences. Our AI and Machine Learning-enabled platform empowers Healthcare Providers to achieve better outcomes, faster and smarter."
VirtualSphere,Gaming,"A Virtual solution for Teachers in Gaming. VirtualSphere brings Virtual Sphere to Gaming. Serving Teachers, we ensure efficiency, affordability, and unmatched innovation through Cybersecurity Innovations technology."
VirtualAnalytics,FoodTech,"A Virtual solution for Environmentalists in FoodTech. VirtualAnalytics is a Virtual Analytics designed specifically for Environmentalists. By leveraging Cloud Computing, it transforms how FoodTech operates. Users enjoy an intuitive interface, powerful analytics, and scalable solutions."
Data-DrivenAssistant,Remote Work Solutions,"A Data-Driven Assistant for Remote Work Solutions needs. Data-DrivenAssistant revolutionizes Remote Work Solutions with Data-Driven Assistant. Tailored for Researchers, it ensures seamless interaction, advanced security, and insightful data to drive decisions."
SecurePlatform,SaaS,"A Secure Platform connecting Researchers in SaaS. SecurePlatform revolutionizes SaaS with Secure Platform. Tailored for Researchers, it ensures seamless interaction, advanced security, and insightful data to drive decisions."
Data-DrivenPlatform,Blockchain,"A Data-Driven Platform connecting Environmentalists in Blockchain. At Data-DrivenPlatform, we deliver Data-Driven Platform that reshapes Blockchain experiences. Our IoT Systems-enabled platform empowers Environmentalists to achieve better outcomes, faster and smarter."
SmartGrid,FinTech,"An Smart platform revolutionizing FinTech. SmartGrid revolutionizes FinTech with Smart Grid. Tailored for Gamers, it ensures seamless interaction, advanced security, and insightful data to drive decisions."
AutomatedExchange,AgriTech,"A Automated Exchange connecting Pet Owners in AgriTech. AutomatedExchange brings Automated Exchange to AgriTech. Serving Pet Owners, we ensure efficiency, affordability, and unmatched innovation through IoT Systems technology."
SmartNetwork,PropTech,"A Smart solution for Travel Enthusiasts in PropTech. SmartNetwork revolutionizes PropTech with Smart Network. Tailored for Travel Enthusiasts, it ensures seamless interaction, advanced security, and insightful data to drive decisions."
PersonalizedAnalytics,EdTech,"A Personalized solution for Researchers in EdTech. PersonalizedAnalytics is a Personalized Analytics designed specifically for Researchers. By leveraging Edge Computing, it transforms how EdTech operates. Users enjoy an intuitive interface, powerful analytics, and scalable solutions."
VirtualCloud,Gaming,"A Virtual Cloud for Gaming needs. VirtualCloud brings Virtual Cloud to Gaming. Serving Elderly, we ensure efficiency, affordability, and unmatched innovation through 5G Networks technology."
AutomatedStudio,GreenTech,"A Automated solution for Fitness Enthusiasts in GreenTech. AutomatedStudio is a Automated Studio designed specifically for Fitness Enthusiasts. By leveraging Blockchain Technology, it transforms how GreenTech operates. Users enjoy an intuitive interface, powerful analytics, and scalable solutions."
AI-poweredCore,PetTech,"An AI-powered platform revolutionizing PetTech. AI-poweredCore revolutionizes PetTech with AI-powered Core. Tailored for Nonprofits, it ensures seamless interaction, advanced security, and insightful data to drive decisions."
AffordableGrid,AI & ML,"A Affordable Grid connecting Fitness Enthusiasts in AI & ML. AffordableGrid revolutionizes AI & ML with Affordable Grid. Tailored for Fitness Enthusiasts, it ensures seamless interaction, advanced security, and insightful data to drive decisions."
On-DemandSystems,AI & ML,"A On-Demand Systems connecting Travel Enthusiasts in AI & ML. On-DemandSystems revolutionizes AI & ML with On-Demand Systems. Tailored for Travel Enthusiasts, it ensures seamless interaction, advanced security, and insightful data to drive decisions."
SecureWorks,RetailTech,"A Secure solution for Teachers in RetailTech. SecureWorks brings Secure Works to RetailTech. Serving Teachers, we ensure efficiency, affordability, and unmatched innovation through Cybersecurity Innovations technology."
InteractivePlatform,EdTech,"A Interactive Platform for EdTech needs. InteractivePlatform is a Interactive Platform designed specifically for Elderly. By leveraging Edge Computing, it transforms how EdTech operates. Users enjoy an intuitive interface, powerful analytics, and scalable solutions."
SecureMarketplace,TravelTech,"A Secure solution for Elderly in TravelTech. SecureMarketplace revolutionizes TravelTech with Secure Marketplace. Tailored for Elderly, it ensures seamless interaction, advanced security, and insightful data to drive decisions."
SustainablePlatform,Wearable Tech,"An Sustainable platform revolutionizing Wearable Tech. SustainablePlatform is a Sustainable Platform designed specifically for Gamers. By leveraging AI and Machine Learning, it transforms how Wearable Tech operates. Users enjoy an intuitive interface, powerful analytics, and scalable solutions."
DecentralizedWorks,Gaming,"A Decentralized Works for Gaming needs. DecentralizedWorks revolutionizes Gaming with Decentralized Works. Tailored for Investors, it ensures seamless interaction, advanced security, and insightful data to drive decisions."
InteractiveEngine,GreenTech,"A Interactive Engine for GreenTech needs. InteractiveEngine is a Interactive Engine designed specifically for Investors. By leveraging Cybersecurity Innovations, it transforms how GreenTech operates. Users enjoy an intuitive interface, powerful analytics, and scalable solutions."
