product_name,product_domain,product_description
AffordableEngine,FinTech,"A Affordable Engine connecting Students in FinTech. AffordableEngine is a Affordable Engine designed specifically for Students. By leveraging Predictive Analytics, it transforms how FinTech operates. Users enjoy an intuitive interface, powerful analytics, and scalable solutions."
CollaborativeStudio,AgriTech,"An Collaborative platform revolutionizing AgriTech. CollaborativeStudio revolutionizes AgriTech with Collaborative Studio. Tailored for Pet Owners, it ensures seamless interaction, advanced security, and insightful data to drive decisions."
Data-DrivenStudio,Wearable Tech,"A Data-Driven Studio for Wearable Tech needs. Data-DrivenStudio is a Data-Driven Studio designed specifically for Pet Owners. By leveraging IoT Systems, it transforms how Wearable Tech operates. Users enjoy an intuitive interface, powerful analytics, and scalable solutions."
Data-DrivenSystems,Mental Health,"A Data-Driven solution for Healthcare Providers in Mental Health. Data-DrivenSystems revolutionizes Mental Health with Data-Driven Systems. Tailored for Healthcare Providers, it ensures seamless interaction, advanced security, and insightful data to drive decisions."
PersonalizedWorks,RetailTech,"An Personalized platform revolutionizing RetailTech. PersonalizedWorks brings Personalized Works to RetailTech. Serving Pet Owners, we ensure efficiency, affordability, and unmatched innovation through Blockchain Technology technology."
On-DemandEngine,PetTech,"A On-Demand way to innovate PetTech. On-DemandEngine is a On-Demand Engine designed specifically for Healthcare Providers. By leveraging IoT Systems, it transforms how PetTech operates. Users enjoy an intuitive interface, powerful analytics, and scalable solutions."
AutomatedMarketplace,FoodTech,"An Automated platform revolutionizing FoodTech. AutomatedMarketplace brings Automated Marketplace to FoodTech. Serving Pet Owners, we ensure efficiency, affordability, and unmatched innovation through Cloud Computing technology."
SmartExchange,E-commerce,"A Smart Exchange connecting Travel Enthusiasts in E-commerce. SmartExchange is a Smart Exchange designed specifically for Travel Enthusiasts. By leveraging Augmented Reality, it transforms how E-commerce operates. Users enjoy an intuitive interface, powerful analytics, and scalable solutions."
AI-poweredLabs,FinTech,"A AI-powered Labs connecting Investors in FinTech. AI-poweredLabs revolutionizes FinTech with AI-powered Labs. Tailored for Investors, it ensures seamless interaction, advanced security, and insightful data to drive decisions."
NextGenMarketplace,SaaS,"A NextGen way to innovate SaaS. NextGenMarketplace brings NextGen Marketplace to SaaS. Serving Nonprofits, we ensure efficiency, affordability, and unmatched innovation through 5G Networks technology."
SmartFramework,E-commerce,"An Smart platform revolutionizing E-commerce. At SmartFramework, we deliver Smart Framework that reshapes E-commerce experiences. Our Augmented Reality-enabled platform empowers Healthcare Providers to achieve better outcomes, faster and smarter."
NextGenFramework,PropTech,"A NextGen Framework for PropTech needs. NextGenFramework brings NextGen Framework to PropTech. Serving Researchers, we ensure efficiency, affordability, and unmatched innovation through Blockchain Technology technology."
SustainableStudio,SaaS,"A Sustainable Studio connecting Artists in SaaS. SustainableStudio is a Sustainable Studio designed specifically for Artists. By leveraging IoT Systems, it transforms how SaaS operates. Users enjoy an intuitive interface, powerful analytics, and scalable solutions."
CollaborativeCloud,PetTech,"A Collaborative way to innovate PetTech. CollaborativeCloud brings Collaborative Cloud to PetTech. Serving Artists, we ensure efficiency, affordability, and unmatched innovation through Augmented Reality technology."
InteractiveWorks,Mental Health,"A Interactive Works for Mental Health needs. InteractiveWorks brings Interactive Works to Mental Health. Serving Pet Owners, we ensure efficiency, affordability, and unmatched innovation through IoT Systems technology."
Data-DrivenSystems,Blockchain,"A Data-Driven Systems for Blockchain needs. Data-DrivenSystems brings Data-Driven Systems to Blockchain. Serving Retailers, we ensure efficiency, affordability, and unmatched innovation through Big Data technology."
NextGenStudio,AgriTech,"A NextGen way to innovate AgriTech. NextGenStudio revolutionizes AgriTech with NextGen Studio. Tailored for Researchers, it ensures seamless interaction, advanced security, and insightful data to drive decisions."
AffordableNest,Cybersecurity,"An Affordable platform revolutionizing Cybersecurity. AffordableNest revolutionizes Cybersecurity with Affordable Nest. Tailored for Teachers, it ensures seamless interaction, advanced security, and insightful data to drive decisions."
DecentralizedSolutions,Cybersecurity,"A Decentralized way to innovate Cybersecurity. At DecentralizedSolutions, we deliver Decentralized Solutions that reshapes Cybersecurity experiences. Our Cybersecurity Innovations-enabled platform empowers Fitness Enthusiasts to achieve better outcomes, faster and smarter."
DecentralizedSolutions,Mental Health,"A Decentralized Solutions connecting Pet Owners in Mental Health. DecentralizedSolutions is a Decentralized Solutions designed specifically for Pet Owners. By leveraging Augmented Reality, it transforms how Mental Health operates. Users enjoy an intuitive interface, powerful analytics, and scalable solutions."
IntelligentSphere,Cybersecurity,"A Intelligent solution for Environmentalists in Cybersecurity. IntelligentSphere revolutionizes Cybersecurity with Intelligent Sphere. Tailored for Environmentalists, it ensures seamless interaction, advanced security, and insightful data to drive decisions."
SecureCore,Mental Health,"A Secure way to innovate Mental Health. SecureCore revolutionizes Mental Health with Secure Core. Tailored for Startups, it ensures seamless interaction, advanced security, and insightful data to drive decisions."
NextGenNetwork,Mental Health,"An NextGen platform revolutionizing Mental Health. NextGenNetwork revolutionizes Mental Health with NextGen Network. Tailored for Parents, it ensures seamless interaction, advanced security, and insightful data to drive decisions."
SustainableAssistant,Mental Health,"A Sustainable solution for Environmentalists in Mental Health. SustainableAssistant revolutionizes Mental Health with Sustainable Assistant. Tailored for Environmentalists, it ensures seamless interaction, advanced security, and insightful data to drive decisions."
AffordableMarketplace,Mental Health,"A Affordable Marketplace for Mental Health needs. AffordableMarketplace is a Affordable Marketplace designed specifically for Environmentalists. By leveraging Cybersecurity Innovations, it transforms how Mental Health operates. Users enjoy an intuitive interface, powerful analytics, and scalable solutions."
CollaborativeEngine,FoodTech,"An Collaborative platform revolutionizing FoodTech. CollaborativeEngine brings Collaborative Engine to FoodTech. Serving Freelancers, we ensure efficiency, affordability, and unmatched innovation through 5G Networks technology."
IntelligentNest,Wearable Tech,"A Intelligent way to innovate Wearable Tech. At IntelligentNest, we deliver Intelligent Nest that reshapes Wearable Tech experiences. Our Augmented Reality-enabled platform empowers Artists to achieve better outcomes, faster and smarter."
SustainableSystems,E-commerce,"An Sustainable platform revolutionizing E-commerce. At SustainableSystems, we deliver Sustainable Systems that reshapes E-commerce experiences. Our AI and Machine Learning-enabled platform empowers Elderly to achieve better outcomes, faster and smarter."
SmartNetwork,TravelTech,"A Smart Network for TravelTech needs. SmartNetwork revolutionizes TravelTech with Smart Network. Tailored for Parents, it ensures seamless interaction, advanced security, and insightful data to drive decisions."
CollaborativeSolutions,Gaming,"An Collaborative platform revolutionizing Gaming. CollaborativeSolutions is a Collaborative Solutions designed specifically for Retailers. By leveraging Cybersecurity Innovations, it transforms how Gaming operates. Users enjoy an intuitive interface, powerful analytics, and scalable solutions."
SecurePulse,Gaming,"A Secure Pulse for Gaming needs. SecurePulse brings Secure Pulse to Gaming. Serving Artists, we ensure efficiency, affordability, and unmatched innovation through Edge Computing technology."
SmartSolutions,Fitness,"A Smart Solutions for Fitness needs. SmartSolutions brings Smart Solutions to Fitness. Serving Small Businesses, we ensure efficiency, affordability, and unmatched innovation through Blockchain Technology technology."
AffordableStudio,Fitness,"An Affordable platform revolutionizing Fitness. AffordableStudio revolutionizes Fitness with Affordable Studio. Tailored for Elderly, it ensures seamless interaction, advanced security, and insightful data to drive decisions."
IntelligentCloud,RetailTech,"A Intelligent Cloud for RetailTech needs. IntelligentCloud revolutionizes RetailTech with Intelligent Cloud. Tailored for Healthcare Providers, it ensures seamless interaction, advanced security, and insightful data to drive decisions."
InteractiveLabs,GreenTech,"A Interactive solution for Researchers in GreenTech. InteractiveLabs is a Interactive Labs designed specifically for Researchers. By leveraging Cybersecurity Innovations, it transforms how GreenTech operates. Users enjoy an intuitive interface, powerful analytics, and scalable solutions."
AffordableNetwork,RetailTech,"A Affordable Network for RetailTech needs. AffordableNetwork revolutionizes RetailTech with Affordable Network. Tailored for Freelancers, it ensures seamless interaction, advanced security, and insightful data to drive decisions."
DecentralizedExchange,GreenTech,"A Decentralized Exchange for GreenTech needs. DecentralizedExchange revolutionizes GreenTech with Decentralized Exchange. Tailored for Nonprofits, it ensures seamless interaction, advanced security, and insightful data to drive decisions."
IntelligentEngine,Fitness,"A Intelligent solution for Developers in Fitness. IntelligentEngine revolutionizes Fitness with Intelligent Engine. Tailored for Developers, it ensures seamless interaction, advanced security, and insightful data to drive decisions."
AutomatedAnalytics,RetailTech,"A Automated Analytics connecting Remote Workers in RetailTech. AutomatedAnalytics is a Automated Analytics designed specifically for Remote Workers. By leveraging AI and Machine Learning, it transforms how RetailTech operates. Users enjoy an intuitive interface, powerful analytics, and scalable solutions."
SustainableNest,Remote Work Solutions,"An Sustainable platform revolutionizing Remote Work Solutions. At SustainableNest, we deliver Sustainable Nest that reshapes Remote Work Solutions experiences. Our AI and Machine Learning-enabled platform empowers Remote Workers to achieve better outcomes, faster and smarter."
SustainableNetwork,Mental Health,"A Sustainable way to innovate Mental Health. SustainableNetwork is a Sustainable Network designed specifically for Artists. By leveraging IoT Systems, it transforms how Mental Health operates. Users enjoy an intuitive interface, powerful analytics, and scalable solutions."
AutomatedAnalytics,Wearable Tech,"A Automated solution for Small Businesses in Wearable Tech. AutomatedAnalytics is a Automated Analytics designed specifically for Small Businesses. By leveraging Cloud Computing, it transforms how Wearable Tech operates. Users enjoy an intuitive interface, powerful analytics, and scalable solutions."
On-DemandLabs,GreenTech,"An On-Demand platform revolutionizing GreenTech. At On-DemandLabs, we deliver On-Demand Labs that reshapes GreenTech experiences. Our AI and Machine Learning-enabled platform empowers Gamers to achieve better outcomes, faster and smarter."
SustainableLabs,PropTech,"An Sustainable platform revolutionizing PropTech. SustainableLabs is a Sustainable Labs designed specifically for Pet Owners. By leveraging AI and Machine Learning, it transforms how PropTech operates. Users enjoy an intuitive interface, powerful analytics, and scalable solutions."
AffordableFramework,E-commerce,"A Affordable solution for Remote Workers in E-commerce. AffordableFramework brings Affordable Framework to E-commerce. Serving Remote Workers, we ensure efficiency, affordability, and unmatched innovation through 5G Networks technology."
IntelligentLabs,AI & ML,"A Intelligent way to innovate AI & ML. IntelligentLabs brings Intelligent Labs to AI & ML. Serving Investors, we ensure efficiency, affordability, and unmatched innovation through 5G Networks technology."
AutomatedEngine,TravelTech,"An Automated platform revolutionizing TravelTech. At AutomatedEngine, we deliver Automated Engine that reshapes TravelTech experiences. Our Augmented Reality-enabled platform empowers Nonprofits to achieve better outcomes, faster and smarter."
IntelligentSolutions,Wearable Tech,"An Intelligent platform revolutionizing Wearable Tech. IntelligentSolutions revolutionizes Wearable Tech with Intelligent Solutions. Tailored for Nonprofits, it ensures seamless interaction, advanced security, and insightful data to drive decisions."
On-DemandEngine,Blockchain,"A On-Demand Engine connecting Environmentalists in Blockchain. On-DemandEngine is a On-Demand Engine designed specifically for Environmentalists. By leveraging IoT Systems, it transforms how Blockchain operates. Users enjoy an intuitive interface, powerful analytics, and scalable solutions."
NextGenAssistant,FoodTech,"A NextGen way to innovate FoodTech. At NextGenAssistant, we deliver NextGen Assistant that reshapes FoodTech experiences. Our Predictive Analytics-enabled platform empowers Healthcare Providers to achieve better outcomes, faster and smarter."
SmartMarketplace,Remote Work Solutions,"A Smart Marketplace for Remote Work Solutions needs. SmartMarketplace is a Smart Marketplace designed specifically for Teachers. By leveraging Cybersecurity Innovations, it transforms how Remote Work Solutions operates. Users enjoy an intuitive interface, powerful analytics, and scalable solutions."
SmartCore,FinTech,"A Smart solution for Students in FinTech. SmartCore revolutionizes FinTech with Smart Core. Tailored for Students, it ensures seamless interaction, advanced security, and insightful data to drive decisions."
InteractiveFramework,AI & ML,"A Interactive Framework for AI & ML needs. InteractiveFramework revolutionizes AI & ML with Interactive Framework. Tailored for Small Businesses, it ensures seamless interaction, advanced security, and insightful data to drive decisions."
AutomatedCore,Cybersecurity,"A Automated Core connecting Freelancers in Cybersecurity. AutomatedCore brings Automated Core to Cybersecurity. Serving Freelancers, we ensure efficiency, affordability, and unmatched innovation through Augmented Reality technology."
AffordableAssistant,EdTech,"A Affordable Assistant connecting Fitness Enthusiasts in EdTech. At AffordableAssistant, we deliver Affordable Assistant that reshapes EdTech experiences. Our 5G Networks-enabled platform empowers Fitness Enthusiasts to achieve better outcomes, faster and smarter."
SustainableLabs,HealthTech,"An Sustainable platform revolutionizing HealthTech. SustainableLabs revolutionizes HealthTech with Sustainable Labs. Tailored for Small Businesses, it ensures seamless interaction, advanced security, and insightful data to drive decisions."
CollaborativeGrid,Blockchain,"A Collaborative way to innovate Blockchain. CollaborativeGrid is a Collaborative Grid designed specifically for Developers. By leveraging Big Data, it transforms how Blockchain operates. Users enjoy an intuitive interface, powerful analytics, and scalable solutions."
On-DemandGrid,PropTech,"A On-Demand Grid for PropTech needs. On-DemandGrid is a On-Demand Grid designed specifically for Retailers. By leveraging 5G Networks, it transforms how PropTech operates. Users enjoy an intuitive interface, powerful analytics, and scalable solutions."
SecureEngine,Cybersecurity,"A Secure solution for Gamers in Cybersecurity. SecureEngine revolutionizes Cybersecurity with Secure Engine. Tailored for Gamers, it ensures seamless interaction, advanced security, and insightful data to drive decisions."
Data-DrivenLabs,Blockchain,"A Data-Driven way to innovate Blockchain. Data-DrivenLabs is a Data-Driven Labs designed specifically for Teachers. By leveraging AI and Machine Learning, it transforms how Blockchain operates. Users enjoy an intuitive interface, powerful analytics, and scalable solutions."
AI-poweredPlatform,E-commerce,"A AI-powered way to innovate E-commerce. At AI-poweredPlatform, we deliver AI-powered Platform that reshapes E-commerce experiences. Our Blockchain Technology-enabled platform empowers Teachers to achieve better outcomes, faster and smarter."
DecentralizedWorks,Remote Work Solutions,"A Decentralized Works connecting Environmentalists in Remote Work Solutions. DecentralizedWorks brings Decentralized Works to Remote Work Solutions. Serving Environmentalists, we ensure efficiency, affordability, and unmatched innovation through Predictive Analytics technology."
DecentralizedNest,AgriTech,"A Decentralized Nest connecting Researchers in AgriTech. DecentralizedNest brings Decentralized Nest to AgriTech. Serving Researchers, we ensure efficiency, affordability, and unmatched innovation through Cloud Computing technology."
SustainableHub,FinTech,"An Sustainable platform revolutionizing FinTech. SustainableHub is a Sustainable Hub designed specifically for Environmentalists. By leveraging Predictive Analytics, it transforms how FinTech operates. Users enjoy an intuitive interface, powerful analytics, and scalable solutions."
SustainableNest,Gaming,"A Sustainable way to innovate Gaming. SustainableNest is a Sustainable Nest designed specifically for Investors. By leveraging Cybersecurity Innovations, it transforms how Gaming operates. Users enjoy an intuitive interface, powerful analytics, and scalable solutions."
AutomatedCore,SaaS,"A Automated Core for SaaS needs. AutomatedCore is a Automated Core designed specifically for Developers. By leveraging Augmented Reality, it transforms how SaaS operates. Users enjoy an intuitive interface, powerful analytics, and scalable solutions."
IntelligentPulse,EdTech,"A Intelligent Pulse connecting Developers in EdTech. IntelligentPulse revolutionizes EdTech with Intelligent Pulse. Tailored for Developers, it ensures seamless interaction, advanced security, and insightful data to drive decisions."
SustainableFramework,GreenTech,"An Sustainable platform revolutionizing GreenTech. SustainableFramework revolutionizes GreenTech with Sustainable Framework. Tailored for Freelancers, it ensures seamless interaction, advanced security, and insightful data to drive decisions."
DecentralizedExchange,AgriTech,"A Decentralized Exchange connecting Travel Enthusiasts in AgriTech. At DecentralizedExchange, we deliver Decentralized Exchange that reshapes AgriTech experiences. Our Cybersecurity Innovations-enabled platform empowers Travel Enthusiasts to achieve better outcomes, faster and smarter."
AI-poweredStudio,Gaming,"A AI-powered Studio for Gaming needs. At AI-poweredStudio, we deliver AI-powered Studio that reshapes Gaming experiences. Our Big Data-enabled platform empowers Freelancers to achieve better outcomes, faster and smarter."
NextGenExchange,TravelTech,"A NextGen Exchange connecting Teachers in TravelTech. NextGenExchange revolutionizes TravelTech with NextGen Exchange. Tailored for Teachers, it ensures seamless interaction, advanced security, and insightful data to drive decisions."
InteractiveSolutions,Blockchain,"A Interactive way to innovate Blockchain. InteractiveSolutions brings Interactive Solutions to Blockchain. Serving Developers, we ensure efficiency, affordability, and unmatched innovation through AI and Machine Learning technology."
IntelligentCore,RetailTech,"An Intelligent platform revolutionizing RetailTech. IntelligentCore is a Intelligent Core designed specifically for Startups. By leveraging 5G Networks, it transforms how RetailTech operates. Users enjoy an intuitive interface, powerful analytics, and scalable solutions."
VirtualCloud,HealthTech,"A Virtual Cloud connecting Elderly in HealthTech. VirtualCloud is a Virtual Cloud designed specifically for Elderly. By leveraging Cloud Computing, it transforms how HealthTech operates. Users enjoy an intuitive interface, powerful analytics, and scalable solutions."
SustainableExchange,TravelTech,"A Sustainable solution for Remote Workers in TravelTech. At SustainableExchange, we deliver Sustainable Exchange that reshapes TravelTech experiences. Our Big Data-enabled platform empowers Remote Workers to achieve better outcomes, faster and smarter."
PersonalizedCloud,TravelTech,"An Personalized platform revolutionizing TravelTech. PersonalizedCloud is a Personalized Cloud designed specifically for Environmentalists. By leveraging Predictive Analytics, it transforms how TravelTech operates. Users enjoy an intuitive interface, powerful analytics, and scalable solutions."
Data-DrivenSphere,SaaS,"A Data-Driven Sphere for SaaS needs. Data-DrivenSphere brings Data-Driven Sphere to SaaS. Serving Parents, we ensure efficiency, affordability, and unmatched innovation through Big Data technology."
SustainableStudio,FoodTech,"A Sustainable Studio for FoodTech needs. At SustainableStudio, we deliver Sustainable Studio that reshapes FoodTech experiences. Our Predictive Analytics-enabled platform empowers Freelancers to achieve better outcomes, faster and smarter."
CollaborativeCore,GreenTech,"A Collaborative way to innovate GreenTech. CollaborativeCore is a Collaborative Core designed specifically for Small Businesses. By leveraging Augmented Reality, it transforms how GreenTech operates. Users enjoy an intuitive interface, powerful analytics, and scalable solutions."
AffordableMarketplace,AI & ML,"A Affordable Marketplace for AI & ML needs. AffordableMarketplace brings Affordable Marketplace to AI & ML. Serving Artists, we ensure efficiency, affordability, and unmatched innovation through AI and Machine Learning technology."
AI-poweredAnalytics,Fitness,"A AI-powered solution for Developers in Fitness. At AI-poweredAnalytics, we deliver AI-powered Analytics that reshapes Fitness experiences. Our Augmented Reality-enabled platform empowers Developers to achieve better outcomes, faster and smarter."
AI-poweredLabs,Mental Health,"An AI-powered platform revolutionizing Mental Health. AI-poweredLabs revolutionizes Mental Health with AI-powered Labs. Tailored for Environmentalists, it ensures seamless interaction, advanced security, and insightful data to drive decisions."
Data-DrivenGrid,Cybersecurity,"A Data-Driven Grid connecting Students in Cybersecurity. Data-DrivenGrid revolutionizes Cybersecurity with Data-Driven Grid. Tailored for Students, it ensures seamless interaction, advanced security, and insightful data to drive decisions."
AffordableNest,RetailTech,"A Affordable solution for Freelancers in RetailTech. AffordableNest revolutionizes RetailTech with Affordable Nest. Tailored for Freelancers, it ensures seamless interaction, advanced security, and insightful data to drive decisions."
VirtualSphere,HealthTech,"A Virtual solution for Parents in HealthTech. VirtualSphere revolutionizes HealthTech with Virtual Sphere. Tailored for Parents, it ensures seamless interaction, advanced security, and insightful data to drive decisions."
NextGenNest,Mental Health,"A NextGen Nest for Mental Health needs. NextGenNest revolutionizes Mental Health with NextGen Nest. Tailored for Developers, it ensures seamless interaction, advanced security, and insightful data to drive decisions."
DecentralizedPlatform,AgriTech,"A Decentralized Platform connecting Investors in AgriTech. DecentralizedPlatform is a Decentralized Platform designed specifically for Investors. By leveraging Cybersecurity Innovations, it transforms how AgriTech operates. Users enjoy an intuitive interface, powerful analytics, and scalable solutions."
VirtualPlatform,AgriTech,"A Virtual Platform connecting Nonprofits in AgriTech. VirtualPlatform is a Virtual Platform designed specifically for Nonprofits. By leveraging Cybersecurity Innovations, it transforms how AgriTech operates. Users enjoy an intuitive interface, powerful analytics, and scalable solutions."
CollaborativeSystems,GreenTech,"A Collaborative solution for Environmentalists in GreenTech. At CollaborativeSystems, we deliver Collaborative Systems that reshapes GreenTech experiences. Our Predictive Analytics-enabled platform empowers Environmentalists to achieve better outcomes, faster and smarter."
SustainableLabs,AgriTech,"A Sustainable solution for Small Businesses in AgriTech. SustainableLabs revolutionizes AgriTech with Sustainable Labs. Tailored for Small Businesses, it ensures seamless interaction, advanced security, and insightful data to drive decisions."
AutomatedFramework,TravelTech,"An Automated platform revolutionizing TravelTech. AutomatedFramework is a Automated Framework designed specifically for Fitness Enthusiasts. By leveraging Augmented Reality, it transforms how TravelTech operates. Users enjoy an intuitive interface, powerful analytics, and scalable solutions."
On-DemandGrid,SaaS,"A On-Demand Grid connecting Retailers in SaaS. On-DemandGrid brings On-Demand Grid to SaaS. Serving Retailers, we ensure efficiency, affordability, and unmatched innovation through Cybersecurity Innovations technology."
