product_name,product_domain,product_description
IntelligentStudio,Mental Health,"An Intelligent platform revolutionizing Mental Health. IntelligentStudio is a Intelligent Studio designed specifically for Pet Owners. By leveraging Augmented Reality, it transforms how Mental Health operates. Users enjoy an intuitive interface, powerful analytics, and scalable solutions."
InteractiveFramework,Remote Work Solutions,"A Interactive solution for Freelancers in Remote Work Solutions. InteractiveFramework revolutionizes Remote Work Solutions with Interactive Framework. Tailored for Freelancers, it ensures seamless interaction, advanced security, and insightful data to drive decisions."
DecentralizedWorks,Blockchain,"A Decentralized way to innovate Blockchain. DecentralizedWorks is a Decentralized Works designed specifically for Gamers. By leveraging Augmented Reality, it transforms how Blockchain operates. Users enjoy an intuitive interface, powerful analytics, and scalable solutions."
CollaborativeExchange,PropTech,"An Collaborative platform revolutionizing PropTech. CollaborativeExchange brings Collaborative Exchange to PropTech. Serving Students, we ensure efficiency, affordability, and unmatched innovation through Cloud Computing technology."
PersonalizedExchange,Gaming,"A Personalized Exchange for Gaming needs. At PersonalizedExchange, we deliver Personalized Exchange that reshapes Gaming experiences. Our Edge Computing-enabled platform empowers Teachers to achieve better outcomes, faster and smarter."
InteractiveStudio,FinTech,"An Interactive platform revolutionizing FinTech. InteractiveStudio is a Interactive Studio designed specifically for Environmentalists. By leveraging Blockchain Technology, it transforms how FinTech operates. Users enjoy an intuitive interface, powerful analytics, and scalable solutions."
VirtualAssistant,AgriTech,"An Virtual platform revolutionizing AgriTech. At VirtualAssistant, we deliver Virtual Assistant that reshapes AgriTech experiences. Our Blockchain Technology-enabled platform empowers Parents to achieve better outcomes, faster and smarter."
DecentralizedNetwork,EdTech,"An Decentralized platform revolutionizing EdTech. DecentralizedNetwork is a Decentralized Network designed specifically for Students. By leveraging Augmented Reality, it transforms how EdTech operates. Users enjoy an intuitive interface, powerful analytics, and scalable solutions."
VirtualGrid,Wearable Tech,"A Virtual Grid connecting Retailers in Wearable Tech. VirtualGrid is a Virtual Grid designed specifically for Retailers. By leveraging Edge Computing, it transforms how Wearable Tech operates. Users enjoy an intuitive interface, powerful analytics, and scalable solutions."
DecentralizedHub,PetTech,"A Decentralized Hub connecting Parents in PetTech. DecentralizedHub brings Decentralized Hub to PetTech. Serving Parents, we ensure efficiency, affordability, and unmatched innovation through Augmented Reality technology."
SmartAssistant,TravelTech,"A Smart solution for Environmentalists in TravelTech. SmartAssistant revolutionizes TravelTech with Smart Assistant. Tailored for Environmentalists, it ensures seamless interaction, advanced security, and insightful data to drive decisions."
Data-DrivenNest,Mental Health,"A Data-Driven way to innovate Mental Health. At Data-DrivenNest, we deliver Data-Driven Nest that reshapes Mental Health experiences. Our Cloud Computing-enabled platform empowers Researchers to achieve better outcomes, faster and smarter."
SecureAssistant,PropTech,"An Secure platform revolutionizing PropTech. SecureAssistant revolutionizes PropTech with Secure Assistant. Tailored for Elderly, it ensures seamless interaction, advanced security, and insightful data to drive decisions."
VirtualSolutions,PetTech,"A Virtual Solutions for PetTech needs. At VirtualSolutions, we deliver Virtual Solutions that reshapes PetTech experiences. Our Cybersecurity Innovations-enabled platform empowers Students to achieve better outcomes, faster and smarter."
VirtualCore,Cybersecurity,"A Virtual Core connecting Investors in Cybersecurity. VirtualCore revolutionizes Cybersecurity with Virtual Core. Tailored for Investors, it ensures seamless interaction, advanced security, and insightful data to drive decisions."
InteractivePulse,Cybersecurity,"A Interactive way to innovate Cybersecurity. InteractivePulse revolutionizes Cybersecurity with Interactive Pulse. Tailored for Artists, it ensures seamless interaction, advanced security, and insightful data to drive decisions."
AutomatedGrid,Wearable Tech,"An Automated platform revolutionizing Wearable Tech. At AutomatedGrid, we deliver Automated Grid that reshapes Wearable Tech experiences. Our Cloud Computing-enabled platform empowers Travel Enthusiasts to achieve better outcomes, faster and smarter."
SmartNetwork,TravelTech,"A Smart Network for TravelTech needs. SmartNetwork is a Smart Network designed specifically for Pet Owners. By leveraging Augmented Reality, it transforms how TravelTech operates. Users enjoy an intuitive interface, powerful analytics, and scalable solutions."
AutomatedAssistant,PetTech,"A Automated Assistant connecting Pet Owners in PetTech. AutomatedAssistant revolutionizes PetTech with Automated Assistant. Tailored for Pet Owners, it ensures seamless interaction, advanced security, and insightful data to drive decisions."
SecureExchange,Remote Work Solutions,"An Secure platform revolutionizing Remote Work Solutions. SecureExchange brings Secure Exchange to Remote Work Solutions. Serving Teachers, we ensure efficiency, affordability, and unmatched innovation through Blockchain Technology technology."
Data-DrivenAssistant,Mental Health,"A Data-Driven solution for Small Businesses in Mental Health. Data-DrivenAssistant is a Data-Driven Assistant designed specifically for Small Businesses. By leveraging Edge Computing, it transforms how Mental Health operates. Users enjoy an intuitive interface, powerful analytics, and scalable solutions."
AutomatedAssistant,HealthTech,"An Automated platform revolutionizing HealthTech. AutomatedAssistant revolutionizes HealthTech with Automated Assistant. Tailored for Investors, it ensures seamless interaction, advanced security, and insightful data to drive decisions."
AffordableCloud,Blockchain,"A Affordable Cloud connecting Fitness Enthusiasts in Blockchain. AffordableCloud revolutionizes Blockchain with Affordable Cloud. Tailored for Fitness Enthusiasts, it ensures seamless interaction, advanced security, and insightful data to drive decisions."
VirtualPulse,TravelTech,"A Virtual way to innovate TravelTech. VirtualPulse is a Virtual Pulse designed specifically for Environmentalists. By leveraging AI and Machine Learning, it transforms how TravelTech operates. Users enjoy an intuitive interface, powerful analytics, and scalable solutions."
PersonalizedNest,Mental Health,"A Personalized solution for Elderly in Mental Health. PersonalizedNest revolutionizes Mental Health with Personalized Nest. Tailored for Elderly, it ensures seamless interaction, advanced security, and insightful data to drive decisions."
IntelligentPlatform,FoodTech,"A Intelligent way to innovate FoodTech. IntelligentPlatform revolutionizes FoodTech with Intelligent Platform. Tailored for Environmentalists, it ensures seamless interaction, advanced security, and insightful data to drive decisions."
IntelligentFramework,PropTech,"A Intelligent solution for Travel Enthusiasts in PropTech. IntelligentFramework revolutionizes PropTech with Intelligent Framework. Tailored for Travel Enthusiasts, it ensures seamless interaction, advanced security, and insightful data to drive decisions."
CollaborativeExchange,TravelTech,"A Collaborative Exchange for TravelTech needs. At CollaborativeExchange, we deliver Collaborative Exchange that reshapes TravelTech experiences. Our Edge Computing-enabled platform empowers Developers to achieve better outcomes, faster and smarter."
VirtualPlatform,Gaming,"A Virtual way to innovate Gaming. At VirtualPlatform, we deliver Virtual Platform that reshapes Gaming experiences. Our Big Data-enabled platform empowers Teachers to achieve better outcomes, faster and smarter."
SecureSolutions,Mental Health,"An Secure platform revolutionizing Mental Health. SecureSolutions is a Secure Solutions designed specifically for Startups. By leveraging Cloud Computing, it transforms how Mental Health operates. Users enjoy an intuitive interface, powerful analytics, and scalable solutions."
AI-poweredPulse,Remote Work Solutions,"A AI-powered solution for Retailers in Remote Work Solutions. AI-poweredPulse is a AI-powered Pulse designed specifically for Retailers. By leveraging Edge Computing, it transforms how Remote Work Solutions operates. Users enjoy an intuitive interface, powerful analytics, and scalable solutions."
AI-poweredFramework,Blockchain,"A AI-powered Framework connecting Healthcare Providers in Blockchain. At AI-poweredFramework, we deliver AI-powered Framework that reshapes Blockchain experiences. Our IoT Systems-enabled platform empowers Healthcare Providers to achieve better outcomes, faster and smarter."
PersonalizedCloud,SaaS,"An Personalized platform revolutionizing SaaS. PersonalizedCloud revolutionizes SaaS with Personalized Cloud. Tailored for Elderly, it ensures seamless interaction, advanced security, and insightful data to drive decisions."
SustainablePlatform,Gaming,"A Sustainable Platform for Gaming needs. SustainablePlatform is a Sustainable Platform designed specifically for Students. By leveraging Blockchain Technology, it transforms how Gaming operates. Users enjoy an intuitive interface, powerful analytics, and scalable solutions."
AutomatedStudio,FoodTech,"An Automated platform revolutionizing FoodTech. AutomatedStudio brings Automated Studio to FoodTech. Serving Fitness Enthusiasts, we ensure efficiency, affordability, and unmatched innovation through Cloud Computing technology."
DecentralizedFramework,GreenTech,"A Decentralized Framework for GreenTech needs. DecentralizedFramework revolutionizes GreenTech with Decentralized Framework. Tailored for Remote Workers, it ensures seamless interaction, advanced security, and insightful data to drive decisions."
AffordablePulse,FoodTech,"A Affordable Pulse connecting Developers in FoodTech. AffordablePulse is a Affordable Pulse designed specifically for Developers. By leveraging Predictive Analytics, it transforms how FoodTech operates. Users enjoy an intuitive interface, powerful analytics, and scalable solutions."
AffordableSphere,Remote Work Solutions,"A Affordable way to innovate Remote Work Solutions. AffordableSphere revolutionizes Remote Work Solutions with Affordable Sphere. Tailored for Remote Workers, it ensures seamless interaction, advanced security, and insightful data to drive decisions."
SustainableNetwork,FoodTech,"A Sustainable solution for Gamers in FoodTech. At SustainableNetwork, we deliver Sustainable Network that reshapes FoodTech experiences. Our AI and Machine Learning-enabled platform empowers Gamers to achieve better outcomes, faster and smarter."
AffordableCore,Fitness,"A Affordable solution for Startups in Fitness. AffordableCore is a Affordable Core designed specifically for Startups. By leveraging Augmented Reality, it transforms how Fitness operates. Users enjoy an intuitive interface, powerful analytics, and scalable solutions."
SecureFramework,Remote Work Solutions,"An Secure platform revolutionizing Remote Work Solutions. At SecureFramework, we deliver Secure Framework that reshapes Remote Work Solutions experiences. Our IoT Systems-enabled platform empowers Elderly to achieve better outcomes, faster and smarter."
AutomatedGrid,SaaS,"A Automated Grid for SaaS needs. At AutomatedGrid, we deliver Automated Grid that reshapes SaaS experiences. Our Blockchain Technology-enabled platform empowers Artists to achieve better outcomes, faster and smarter."
InteractiveMarketplace,Mental Health,"A Interactive way to innovate Mental Health. InteractiveMarketplace is a Interactive Marketplace designed specifically for Investors. By leveraging Big Data, it transforms how Mental Health operates. Users enjoy an intuitive interface, powerful analytics, and scalable solutions."
DecentralizedSphere,GreenTech,"A Decentralized way to innovate GreenTech. DecentralizedSphere revolutionizes GreenTech with Decentralized Sphere. Tailored for Nonprofits, it ensures seamless interaction, advanced security, and insightful data to drive decisions."
IntelligentNest,Wearable Tech,"A Intelligent Nest for Wearable Tech needs. IntelligentNest is a Intelligent Nest designed specifically for Healthcare Providers. By leveraging Augmented Reality, it transforms how Wearable Tech operates. Users enjoy an intuitive interface, powerful analytics, and scalable solutions."
CollaborativeAnalytics,PetTech,"A Collaborative solution for Gamers in PetTech. CollaborativeAnalytics brings Collaborative Analytics to PetTech. Serving Gamers, we ensure efficiency, affordability, and unmatched innovation through 5G Networks technology."
DecentralizedAssistant,SaaS,"A Decentralized Assistant connecting Environmentalists in SaaS. DecentralizedAssistant is a Decentralized Assistant designed specifically for Environmentalists. By leveraging 5G Networks, it transforms how SaaS operates. Users enjoy an intuitive interface, powerful analytics, and scalable solutions."
DecentralizedExchange,Cybersecurity,"A Decentralized solution for Startups in Cybersecurity. DecentralizedExchange brings Decentralized Exchange to Cybersecurity. Serving Startups, we ensure efficiency, affordability, and unmatched innovation through Edge Computing technology."
CollaborativeSolutions,Fitness,"An Collaborative platform revolutionizing Fitness. At CollaborativeSolutions, we deliver Collaborative Solutions that reshapes Fitness experiences. Our IoT Systems-enabled platform empowers Parents to achieve better outcomes, faster and smarter."
InteractiveWorks,Cybersecurity,"A Interactive solution for Artists in Cybersecurity. InteractiveWorks is a Interactive Works designed specifically for Artists. By leveraging IoT Systems, it transforms how Cybersecurity operates. Users enjoy an intuitive interface, powerful analytics, and scalable solutions."
NextGenAnalytics,Mental Health,"An NextGen platform revolutionizing Mental Health. NextGenAnalytics revolutionizes Mental Health with NextGen Analytics. Tailored for Retailers, it ensures seamless interaction, advanced security, and insightful data to drive decisions."
AffordableHub,FoodTech,"A Affordable Hub connecting Students in FoodTech. At AffordableHub, we deliver Affordable Hub that reshapes FoodTech experiences. Our Edge Computing-enabled platform empowers Students to achieve better outcomes, faster and smarter."
InteractiveSphere,Mental Health,"A Interactive Sphere for Mental Health needs. InteractiveSphere is a Interactive Sphere designed specifically for Fitness Enthusiasts. By leveraging Cybersecurity Innovations, it transforms how Mental Health operates. Users enjoy an intuitive interface, powerful analytics, and scalable solutions."
SmartPulse,AI & ML,"A Smart Pulse for AI & ML needs. SmartPulse revolutionizes AI & ML with Smart Pulse. Tailored for Fitness Enthusiasts, it ensures seamless interaction, advanced security, and insightful data to drive decisions."
DecentralizedPlatform,PropTech,"An Decentralized platform revolutionizing PropTech. DecentralizedPlatform revolutionizes PropTech with Decentralized Platform. Tailored for Investors, it ensures seamless interaction, advanced security, and insightful data to drive decisions."
SustainableExchange,Wearable Tech,"A Sustainable solution for Artists in Wearable Tech. At SustainableExchange, we deliver Sustainable Exchange that reshapes Wearable Tech experiences. Our Predictive Analytics-enabled platform empowers Artists to achieve better outcomes, faster and smarter."
DecentralizedNetwork,E-commerce,"A Decentralized way to innovate E-commerce. DecentralizedNetwork revolutionizes E-commerce with Decentralized Network. Tailored for Gamers, it ensures seamless interaction, advanced security, and insightful data to drive decisions."
DecentralizedSystems,Blockchain,"A Decentralized Systems for Blockchain needs. DecentralizedSystems is a Decentralized Systems designed specifically for Small Businesses. By leveraging Blockchain Technology, it transforms how Blockchain operates. Users enjoy an intuitive interface, powerful analytics, and scalable solutions."
InteractiveEngine,AI & ML,"A Interactive way to innovate AI & ML. InteractiveEngine is a Interactive Engine designed specifically for Healthcare Providers. By leveraging AI and Machine Learning, it transforms how AI & ML operates. Users enjoy an intuitive interface, powerful analytics, and scalable solutions."
VirtualSystems,E-commerce,"A Virtual Systems for E-commerce needs. VirtualSystems revolutionizes E-commerce with Virtual Systems. Tailored for Investors, it ensures seamless interaction, advanced security, and insightful data to drive decisions."
VirtualHub,PropTech,"A Virtual Hub for PropTech needs. VirtualHub is a Virtual Hub designed specifically for Pet Owners. By leveraging Predictive Analytics, it transforms how PropTech operates. Users enjoy an intuitive interface, powerful analytics, and scalable solutions."
InteractiveEngine,AI & ML,"A Interactive way to innovate AI & ML. InteractiveEngine revolutionizes AI & ML with Interactive Engine. Tailored for Nonprofits, it ensures seamless interaction, advanced security, and insightful data to drive decisions."
IntelligentAssistant,FinTech,"A Intelligent solution for Startups in FinTech. IntelligentAssistant brings Intelligent Assistant to FinTech. Serving Startups, we ensure efficiency, affordability, and unmatched innovation through Edge Computing technology."
CollaborativeCloud,Blockchain,"A Collaborative Cloud connecting Gamers in Blockchain. CollaborativeCloud is a Collaborative Cloud designed specifically for Gamers. By leveraging Big Data, it transforms how Blockchain operates. Users enjoy an intuitive interface, powerful analytics, and scalable solutions."
NextGenCore,Blockchain,"A NextGen way to innovate Blockchain. NextGenCore is a NextGen Core designed specifically for Researchers. By leveraging Augmented Reality, it transforms how Blockchain operates. Users enjoy an intuitive interface, powerful analytics, and scalable solutions."
SecurePlatform,Blockchain,"An Secure platform revolutionizing Blockchain. SecurePlatform brings Secure Platform to Blockchain. Serving Nonprofits, we ensure efficiency, affordability, and unmatched innovation through Augmented Reality technology."
CollaborativePlatform,Mental Health,"A Collaborative Platform connecting Fitness Enthusiasts in Mental Health. CollaborativePlatform is a Collaborative Platform designed specifically for Fitness Enthusiasts. By leveraging 5G Networks, it transforms how Mental Health operates. Users enjoy an intuitive interface, powerful analytics, and scalable solutions."
AI-poweredExchange,AI & ML,"A AI-powered Exchange for AI & ML needs. AI-poweredExchange is a AI-powered Exchange designed specifically for Remote Workers. By leveraging IoT Systems, it transforms how AI & ML operates. Users enjoy an intuitive interface, powerful analytics, and scalable solutions."
VirtualStudio,Remote Work Solutions,"An Virtual platform revolutionizing Remote Work Solutions. VirtualStudio is a Virtual Studio designed specifically for Teachers. By leveraging 5G Networks, it transforms how Remote Work Solutions operates. Users enjoy an intuitive interface, powerful analytics, and scalable solutions."
SmartCloud,Mental Health,"An Smart platform revolutionizing Mental Health. SmartCloud brings Smart Cloud to Mental Health. Serving Healthcare Providers, we ensure efficiency, affordability, and unmatched innovation through Edge Computing technology."
VirtualGrid,AI & ML,"A Virtual Grid for AI & ML needs. VirtualGrid brings Virtual Grid to AI & ML. Serving Pet Owners, we ensure efficiency, affordability, and unmatched innovation through IoT Systems technology."
SmartExchange,FoodTech,"A Smart Exchange connecting Teachers in FoodTech. SmartExchange revolutionizes FoodTech with Smart Exchange. Tailored for Teachers, it ensures seamless interaction, advanced security, and insightful data to drive decisions."
PersonalizedAssistant,FinTech,"A Personalized way to innovate FinTech. PersonalizedAssistant is a Personalized Assistant designed specifically for Artists. By leveraging IoT Systems, it transforms how FinTech operates. Users enjoy an intuitive interface, powerful analytics, and scalable solutions."
SmartHub,EdTech,"A Smart way to innovate EdTech. SmartHub is a Smart Hub designed specifically for Environmentalists. By leveraging Big Data, it transforms how EdTech operates. Users enjoy an intuitive interface, powerful analytics, and scalable solutions."
VirtualGrid,GreenTech,"A Virtual Grid for GreenTech needs. VirtualGrid is a Virtual Grid designed specifically for Nonprofits. By leveraging AI and Machine Learning, it transforms how GreenTech operates. Users enjoy an intuitive interface, powerful analytics, and scalable solutions."
InteractiveExchange,EdTech,"A Interactive solution for Students in EdTech. InteractiveExchange brings Interactive Exchange to EdTech. Serving Students, we ensure efficiency, affordability, and unmatched innovation through AI and Machine Learning technology."
AffordablePlatform,FoodTech,"A Affordable solution for Parents in FoodTech. AffordablePlatform brings Affordable Platform to FoodTech. Serving Parents, we ensure efficiency, affordability, and unmatched innovation through Cloud Computing technology."
NextGenCore,Cybersecurity,"A NextGen way to innovate Cybersecurity. At NextGenCore, we deliver NextGen Core that reshapes Cybersecurity experiences. Our Predictive Analytics-enabled platform empowers Nonprofits to achieve better outcomes, faster and smarter."
AutomatedSystems,FinTech,"A Automated Systems connecting Retailers in FinTech. AutomatedSystems revolutionizes FinTech with Automated Systems. Tailored for Retailers, it ensures seamless interaction, advanced security, and insightful data to drive decisions."
AffordableFramework,RetailTech,"A Affordable solution for Teachers in RetailTech. At AffordableFramework, we deliver Affordable Framework that reshapes RetailTech experiences. Our Edge Computing-enabled platform empowers Teachers to achieve better outcomes, faster and smarter."
Data-DrivenSystems,Wearable Tech,"A Data-Driven solution for Retailers in Wearable Tech. At Data-DrivenSystems, we deliver Data-Driven Systems that reshapes Wearable Tech experiences. Our 5G Networks-enabled platform empowers Retailers to achieve better outcomes, faster and smarter."
InteractivePulse,Wearable Tech,"An Interactive platform revolutionizing Wearable Tech. At InteractivePulse, we deliver Interactive Pulse that reshapes Wearable Tech experiences. Our IoT Systems-enabled platform empowers Researchers to achieve better outcomes, faster and smarter."
SmartLabs,FoodTech,"A Smart solution for Elderly in FoodTech. SmartLabs is a Smart Labs designed specifically for Elderly. By leveraging Cloud Computing, it transforms how FoodTech operates. Users enjoy an intuitive interface, powerful analytics, and scalable solutions."
AffordableHub,Cybersecurity,"An Affordable platform revolutionizing Cybersecurity. At AffordableHub, we deliver Affordable Hub that reshapes Cybersecurity experiences. Our Predictive Analytics-enabled platform empowers Nonprofits to achieve better outcomes, faster and smarter."
DecentralizedSphere,TravelTech,"A Decentralized solution for Researchers in TravelTech. DecentralizedSphere is a Decentralized Sphere designed specifically for Researchers. By leveraging 5G Networks, it transforms how TravelTech operates. Users enjoy an intuitive interface, powerful analytics, and scalable solutions."
NextGenCore,RetailTech,"A NextGen Core for RetailTech needs. NextGenCore revolutionizes RetailTech with NextGen Core. Tailored for Students, it ensures seamless interaction, advanced security, and insightful data to drive decisions."
SmartSolutions,Mental Health,"A Smart way to innovate Mental Health. SmartSolutions is a Smart Solutions designed specifically for Pet Owners. By leveraging Predictive Analytics, it transforms how Mental Health operates. Users enjoy an intuitive interface, powerful analytics, and scalable solutions."
AI-poweredCloud,TravelTech,"An AI-powered platform revolutionizing TravelTech. AI-poweredCloud is a AI-powered Cloud designed specifically for Gamers. By leveraging Edge Computing, it transforms how TravelTech operates. Users enjoy an intuitive interface, powerful analytics, and scalable solutions."
SmartNest,Remote Work Solutions,"A Smart way to innovate Remote Work Solutions. At SmartNest, we deliver Smart Nest that reshapes Remote Work Solutions experiences. Our Predictive Analytics-enabled platform empowers Startups to achieve better outcomes, faster and smarter."
CollaborativeExchange,E-commerce,"An Collaborative platform revolutionizing E-commerce. At CollaborativeExchange, we deliver Collaborative Exchange that reshapes E-commerce experiences. Our Cybersecurity Innovations-enabled platform empowers Gamers to achieve better outcomes, faster and smarter."
VirtualCloud,E-commerce,"An Virtual platform revolutionizing E-commerce. At VirtualCloud, we deliver Virtual Cloud that reshapes E-commerce experiences. Our IoT Systems-enabled platform empowers Students to achieve better outcomes, faster and smarter."
IntelligentPlatform,PetTech,"A Intelligent solution for Pet Owners in PetTech. At IntelligentPlatform, we deliver Intelligent Platform that reshapes PetTech experiences. Our Predictive Analytics-enabled platform empowers Pet Owners to achieve better outcomes, faster and smarter."
