product_name,product_description,product_domain
Tekion,It is a cloud-built platform with advanced machine learning and AI capabilities for a personalized and seamless consumer experience.,AI startup
Brighteye Ventures,Education technology venture capital firm.,Edtech
EzeRx,Developer and manufacturer of medical devices,Medtech
VitalTech,"VitalTech is a develop technologies that empower patients to better care for their safety,",HeathTech
Genius Teacher,"Genius Teacher creates engaging educational content, delivers fun learning experience to the students",Edtech
Ultraviolette Automotive,Ultraviolette Automotive is a technology startup working on electric two-wheelers and energy infrastructure.,Automobiles
Tring,"Tring is a celebrity engagement platform, for all occasions including birthday, anniversaries, get well soon messages.",Social Media
Rare Planet,Rare Planet sells handicrafts made by local artisans.,Retail startup
GoodGamer,GoodGamer is India's first Daily Fantasy Sports and true Esports gaming platform.,Gaming
InnAccel,"A building a portfolio of novel medical devices designed, engineered, and priced for global Emerging Markets.",Medtech
Tiliter,Software that uses computer vision to recognise products without barcodes,Retail
Slintel,"Slintel, a leader in capturing technographics-powered buying intent, helps companies uncover the 3% of active buyers in their target market.",Sles and marketing
SoOLEGAL,"SoOLEGAL is a global integrated directory of lawyers, legal aid organizations, and Law firms.",LegalTech
HobSpace,India's Activity Hub for Kids,Edtech
Supplynote,Supplynote is India's leading procurement platform with a unique stack of SAAS and E-commerce to solve the procurement problem,SaaS startup
Hire Me Car,India's largest cloud based digital discovery and services provisioning platform for the taxi rental,Car Service
ShopUp,"ShopUp provides easy access to B2B sourcing, last-mile logistics, digital credit, and business management solutions to small businesses.",E-commerce
Harmonizer India,"Energy-efficient solutions based on the Artificial Intelligence, Machine Learning and Internet of Things technology,",Tech Startup
Zomato,Zomato is a food delivery and restaurant discovery site that provides information and reviews about restaurants.,FoodTech
Dukaan,Developer of an android application designed for businesses to sell online.,Tech Startup
CredR,India’s Only 100% Inspected and Certified Used Bikes Marketplace.,Bike marketplace
Satyukt,An agritech company that provides business to business (B2B) agricultural data,Agri tech
RACEnergy,RACEnergy builds and deploys battery swapping infrastructure for use in various segments of vehicles.,Automobiles
TREAD,A homegrown fitness startup that aims to advance the 'Fit India' initiative by offering holistic and affordable workouts.,Fitness startup
Anveshan,Provide quality and healthy food products,FoodTech
TeaMonk,India's Finest Specialty Tea company.,Food & Bevarages
Fleetx,"Fleetx is an intelligent data platform which uses AI, machine learning, sensors and predictive analytics to help fleet owners.",Tech Startup
ReNEWate,"Tech platform helping millions of renovation contractors, property improvement professionals and businesses manage their business digitally.",Real Estate
Tango Eye,Retail Video Analytics SaaS product,SaaS startup
Rare Planet,Rare Planet sells handicrafts made by local artisans.,Reatil startup
Avataa Me,AVATAAR.ME is a deep-tech 3D AR platform which delivers personalized fashion discovery experience to users on mobile devices.,AR platform
Arrival,Arrival is a technology company that specializes in developing electric vehicles.,EV startup
Cover Genius,Cover Genius provides an insurance distribution platform designed to protect the customers of e-commerce companies,FinTech
Phononic Vibes,"Phononic Vibes introduces a new patented technology for vibration and noise control and isolation, with a circular economy approach.",Deeptech
MikeLegal,MikeLegal is an AI powered legal associate that aims to build an ecosystem of legal tools,LegalTech
Clair,Clair is a social fintech that provides Instant Pay Access as a Service for human capital management and gig platforms.,FinTech
Gourmet Garden,Gourmet Garden is a global market leader in chilled convenient packaged herbs.,Consumer Goods
Miko,"Miko is an advanced robotics startup founded by three IIT Bombay post-graduates on the pillars of robotics, AI & IoT.",AI startup
Razorpay,"Razorpay is a platform that enables businesses to accept, process, and disburse payments.",FinTech
Ninjacart,"Ninjacart is a business-to-business fresh produce supply chain that connects farmers, manufactures, and brands to retailers directly.",Food Industry
Wow! Momo,Wow! Momo is a chain of fast-food restaurants that specializes in momos.,Food Industry
Pepper Content,Pepper Content is a Content-Mediation Platform that connects talented writers to organisations that require content.,Content marketplace
LIVSPACE,"Livspace is an interior design startup that offers a platform that connects people to designers, services, and products.",Interior Design
Acculi Labs,Acculi Labs is a clinical grade smartphone based diagnostic tool,Healthcare
Your MD,Your.MD is a platform committed to helping a billion people find their health by unlocking self-care with digital technology.,Healthcare
Antaios,Developer of memory-based technology intended to solve issues of advanced computing.,Tech company
Unnati,A helping hand to the farming community through Artificial Intelligence,AgriTech
Disprz,"Disprz is a one-of-its-kind “knowledge-tech” start-up that strives to make people knowledgeable, productive and smarter at what they do.",Edtech
Uni,The team aims to bridge the gap for credit cards and make them more accessible for people across different regions.,FinTech
Credit Wise Capital,CreditWise Capital is a consumer finance company.,FinTech
Chargebee,Chargebee is a PCI Level 1 certified subscription and recurring billing system for SaaS and subscription based eCommerce businesses,SaaS startup
Reliance Retail Ventures Ltd,"Reliance Retail offers online shopping and a chain of neighborhood stores, supermarkets, and wholesale/specialty stores.",Retail
Winuall,"Winuall specializes in the fields of E-learning, online quizzes, and tests, study material for competitive exams.",Edtech
Genrobotics,GenRobotic specializes in powered robotic exoskeletons with RC controlled humanoid robotic systems and Artificial Intelligence.,AI startup
Livve,An online platform where both owners and tenants find help in making sure their rental transaction are safe and secure.,Rental space
Ergos,Ergos is building an integrated supply chain by setting up micro warehouses.,AgriTech
Krishitantra,Krishi-Tantra is an Agri-IoT startup building farm automation for controlled agricultural environment.,Soil-Tech
PakkaProfile,"PakkaProfile bridges the gap between companies and the workforce by making better, unbiased decisions with the help of psychometric games",Recruitment startup
Monet Networks,Monet Networks Using sentiment and non verbal cues analysis for increased engagement and real time content feedback.,AI startup
Unocoin,"Unocoin is an Indian bitcoin processor that enables users to buy, sell, store, use, and accept bitcoins.",FinTech
Pesto,Pesto is a career accelerator for software engineers with the mission to take opportunities to places where talent exists.,Edtech
NirogStreet,NirogStreet is an Ayurvedic doctor discovery and appointment booking platform where patients can easily find doctors and fix consultation.,Ayurveda tech
Bambrew,Bambrew is an online shop for reusable bamboo straws.,Packaging solution startup
Omnify,Omnify is a Global SaaS platform for Small Services Business,SaaS startup
Fanball XI,The gaming company mostly focused on fantasy football games,Gaming
Treebo Hotels,"Treebo is India's tech-enabled, asset-light affordable accommodation brand.",Hospitality
GPS Renewables,To solve the urban waste problem by utilising local technologies and business models.,Cleantech
Public,Video-led social app Public provides users with a platform to share and view important hyperlocal videos,Social Media
Legal Salah,Legal Salah is bringing the provision of imparting value based legal and consultancy services to the user.,LegalTech
FanPlay,FanPlay Technologies operates as a real-money gaming startup.,Gaming
ECOSTP,Eco friendly zero power zero maintenance sewage treatment plant in India.,Sanitation solutions
Coralogix,Coralogix is a log analytics SaaS platform that improves the delivery and maintenance process for software providers.,SaaS startup
Equiwatt,Equiwatt is a digital platform enabling households to get paid for saving energy at peak times.,Tech company
Reliance Retail Ventures,"Reliance Retail offers online shopping and a chain of neighborhood stores, supermarkets, and wholesale/specialty stores.",E-commerce
Zhangmen,Zhangmen is an online tutoring platform provides tutoring courses to students.,Edtech
AgroWave,Agrowave engages in transforming agriculture supply chain by connecting farms to businesses.,AgriTech
Sapio Analytics,Sapio Analytics provides AI-powered policymaking solutions for government institutions.,Tech company
Taimei,Taimei Technology provides a cloud platform for clinical research collaboration.,HealthCare
Avanse Financial Services,"Avanse, regulated by the Reserve Bank of India, is an education finance company that operates as a non-banking finance company (NBFC).",FinTech
Industry Buying,India's largest industrial ecommerce platform,E-commerce
Hopscotch,"Hopscotch provides an insider access to international brands for babies, kids, and moms.",E-commerce
Pristyn Care,Pristyn Care is Health Care Startup that is disrupting Day Care Procedures.,HealthCare
WoodenStreet,Wooden Street is a online furniture platform that provides custom made & ready to order furniture.,Home Design
ACKO,Acko General Insurance is a private sector general insurance company in India.,InsureTech
Farmers Fresh Zone,FarmersFZ is an online venture for fresh and safe vegetables and agri products.,AgriTech
Invento,Invento Robotics specializes in developing service robots intended for customer interactions.,AI Startup
Infurnia,Infurnia Technologies is an eponymous cloud-based architecture design software platform.,Tech Startup
AnalytIQSports's SuperCric,SuperCric is India's first strategy Cricket Manager simulation game,Entertainment
Snowflake,Snowflake is a cloud data platform that provides a data warehouse-as-a-service designed for the cloud.,Tech company
GenieTalk,GenieTalk as a virtual assistant uses AI to bring conversation commerce with a personalised experience on the app.,Tech company
Classplus,Classplus offers a mobile-first SaaS platform for 3000+ tutors to offer their curriculum and operations completely online.,EdTech
Mobile Premier League,Mobile Premier League(MPL) is a skill based E-Sports platform where you can play your favourite mobile games,Entertainment
Fourth Partner Energy,Fourth Partner Energy provides turnkey rooftop solar energy solutions for customers in India.,Solar solution
Flipkart,Flipkart is an e-commerce marketplace that offers over 30 million products cross 70+ categories.,E-commerce
Vivriti Capital,Vivriti Capital is a marketplace for small enterprises and individuals that lack efficient access to financial services.,FinTech
InsuranceDekho,The funding for branding and marketing activities as well as strengthening the product and technology teams,FinTech
BestDoc,An Intelligent Patient Relationship Management (PRM) system for hospitals and other healthcare providers in India.,HealthCare
Byju’s,An Indian educational technology and online tutoring firm,EdTech
Melorra,Melorra is an operator of an online jewelry store that is used to offer contemporary jewelry.,Jewellery startup
Reliance,"Reliance owns businesses across India engaged in energy, petrochemicals, textiles, natural resources",Multinational conglomerate company
Inflexor Ventures,Experienced Venture Capital-General Partner focused on Technology investments.,FinTech
Pandorum,A Bangalore based biotechnology company with focus on tissue engineering and regenerative medicine.,Deeptech startup
SpeakIn,"AI-enabled network of speakers and thought leaders, aka. experts",Social Network
LetsUp,"Provides News, Jobs, Information & Entertainment on WhatsApp, Absolutely free",Publication
Newsreach,NewsReach India offers partner publications a digital footprint,Publication
Dream11,Dream11 is India’s Biggest Sports Game with 30 million+ users playing Fantasy Cricket,Entertainment
SignalX,"An AI-powered SaaS platform for corporate risk and due diligence for a comprehensive financial, legal, regulatory, and reputational risk analysis",SaaS platform
JetSynthesys,Gaming and entertainment startup,Tech
Vesta Space Technology,VestaSpace Technology specialises in making small satellite platforms for commercial and scientific applications.,Tech Startup
Dozee,Dozee offers health and wellness monitoring products.,HealthTech
Rebel Foods,"Known for its larger brands – Faasos, Behrouz Biryani, Oven story and Mandarin",Food
Nykaa,Cosmetics & beauty products online,Fashion
Ketto,"Crowdfunding, Charity, E-commerce",Finance
Suryoday,Banks that extends two distinct fixed deposit schemes,Finance
SucSEED,Venture Partners,Finance
Unacademy,Unacademy is an Indian online education technology company,EdTech
Strata,"Commercial Real Estate, Commercial Property Investment, Best Long Term Investments",Real Estate
3one4 Capital,Use transformative capital and a deep involvement strategy to help Indian entrepreneurs,Venture capital
WE-Hub,WE HUB is the first-of-its-kind and only State-run platform for Women Entrepreneurs.,Entreprenurship
Zomato,Get online food delivery from restaurants near you,Food devlivery
Vicara,A deep tech startup pioneering in motion-based interfaces and insights.,Tech Startup
Gaana,Gaana is a commercial music streaming service providing free and licensed music.,Entertainment
EM3 Agri,A pioneering organization in the farming-as-a service (FaaS) space,AgriTech
Plum,"Shampoos, Conditioner & Hair Mask For Healthy, Happy Hair",Cosmetics
Odwen,India's first do-it-yourself warehouse management system.,Warehouse
Fasal,Captures real-time data on crop growth conditions using on-farm sensors and delivers advisories to farmers in Indian languages,AgriTech
Trukky,"Transportation, logistics services & cargo services.",Logistics
BankBazaar,Check your latest Credit Score and get your Credit Report online in India for Free,Online financial service
Specsmakers,"A leader in crafting stylish, high-quality, eyewear at affordable prices.",Eyeglasses
Grinntech,"Grinntech has a range of Lithium-ion batteries which sets new standards in Electrical safety, Energy density, Durability",Battery design
CreditMantri,CreditMantri is a provider of comprehensive Credit Analysis and Credit Improvement programs.,Online credit management startup
Chai Waale,Given the rising trend in the number of tea stalls in the city,Beverage
Deepsync,"Deepsync is a revolutionary way to record your content, without you really speaking.",Tech Startup
Byju’s,An Indian educational technology and online tutoring firm,EdTech
ConnectedH,The company’s vision is simple – Connected Healthcare.,HealthCare
Reliance Retail,"Retailer delivering superior value to its customers, suppliers and shareholders.",E-commerce
QShala,A platform that helps kids learn about life skills,EdTech
Pitstop,"Pitstop owns and operates a network of garages that provides car repair, detailing",Car Service
Zomato,Get online food delivery from restaurants near you,Food devlivery
Customfit ai,Operates on a SaaS model by providing a hyper-personalised website to users.,SaaS startup
Nirmata,Nirmata offers a complete solution for Kubernetes management and deployment for cloud-based apps,Tech
Hire Me Car,HireMeCar.com offers customers the fastest and easiest way to plan road travel.,TravelTech
Oga Fit,The new-age home workout app that gives you an unmatched boutique digital fitness studio experience.,Fitness startup
ShipsKart,"ShipsKart platform that streamlines the way marine stores are ordered, approved and received on board with the help of technology.",E-commerce
SquadStack,"Empowering consumer businesses to improve their sales conversions and funnel efficiency, using Artificial Intelligence & Data Science.",Tech company
Financepeer,Financepeer is an AI based peer to peer lending platform.,EdTech
Cashify,Cashify.in is an e-commerce platform for reselling used electronic gadgets.,E-commerce
Etrio,"Etrio is an electric vehicle company in India with tata ace electric, Electric Tata ace HT",EV startup
Codeyoung,Codeyoung provides live online coding classes for kids between the age of 5 - 17.,EdTech
StayQrious,"Live online coding courses with social learning. Build coding skills, confident communication and leadership skills with your very own coach.",EdTech
Sunstone Eduversity,India's Only Business School That Offers MBA & PGDM Programs With 100% Placement Assurance.,EdTech
Infilect,Infilect Technologies specialises in visual content intelligence by parsing large-scale visual content such as photos and videos,SaaS startup
MobiGarage,An ecommerce platform for refurbished electronics.,E-commerce
Samunnati,Samunnati is a financial service provider focused on agri value chains.,Agriculture
WeInnovate Biosolutions,Startup working dedicatedly in the area of healthcare-therapeutic solutions.,Startup laboratory
Yummy Corp,"Yummy Corp is a food & beverages company that provides delicious, fresh, and creative food solutions for everyday corporate and group needs.",Food Industry
Smallcase,Smallcases are portfolios of stocks or ETFs created by India's top financial experts.,FinTech
Clairvolex,Clairvolex is an IP solutions company that manages IP assets of large corporations using an IPAM model.,Tech Startup
Assiduus,"Assiduus leverages its eCommerce experience to help build, grow and scale your brand on various eCommerce platforms",E-commerce
Brinton,Brinton is one of the fastest growing Pharmaceutical Companies spreading its network worldwide.,HealthTech
AFK Gaming,AFK Gaming is a media and entertainment and gaming company located in Mumbai.,Entertainment
Infarm,Infarm builds and distributes highly efficient vertical farms throughout cities to grow fresh produce right in your neighbourhood.,AgriTech
Zuper,Zuper is a productivity suite for service businesses to mobile field workforce and automate all business operations.,SaaS startup
mCaffeine,"MCaffeine is a personal care brand that offers caffein-infused face, body, and hair care products.",Personal care startup
Origa,The charioteer of your growth at all times.,FinTech
GullyBuy Software,To deliver a solution that will provide shopping convenience to every consumer in India,Tech Startup
Recordent,A technology-enabled platform that helps MSMEs to increase their business efficiency through collection of dues,FinTech
MPL,Mobile Premier League is the mobile e-Sports platform based in India.,Entertainment
Penny,Offer various development solutions and mainly focus on helping startups,SaaS startup
Onsitego,Onsitego is a customer service company for device and appliance repairs.,Customer service company
Precily,Precily is Artificial Intelligence platform for enterprises that increases efficiency of workforce by providing AI based solutions.,SaaS  startup
SmartClean,SmartClean Technologies is an AI company that offers data-driven cleaning operations designed for facilities.,Tech Startup
ClanConnect,"AI-driven influencer marketing platform ClanConnect.ai, which helps brands make their campaigns more data and result-oriented",Marketing startup
Servify,Servify is a self-learning platform that provides device management services and warranty solutions.,Service industry
ShareChat,ShareChat is a social networking and regional content platform.,Social media
Rephrase.ai,Rephrase.ai helps in creating high-quality videos and animations through an AI-powered visual dubbing tool.,AI
Melorra,"Buy Latest Gold, Diamond & Gemstone Jewellery Designs Online Rings, Earrings, Necklace",Jewellery
FabHotels,FabHotels is a network of 3 star budget hotels in India,Hospitality
EkAnek,EkAnek Networks is a new startup that is focused on building the ecosystem for new age brands in lifestyle categories,Tech Startup
Cub McPaws,Cub McPaws is a kids clothing brand.,AR startup
Zimyo,Employee experience platform that empowers organizations to manage and retain great talent!,HR Tech startup
PumPumPum,Pumpumpum is a car rental company,Automotive Startup
Burgerama,Burgerama is a unit of Junket Foods Private Limited,Food Startup
Moms Co,The Moms Co. creates a safe and natural formulated products for babies that are certified toxin-free,HealthCare
DillyHub,A service that promotes and facilitates the works of independent comic artists,Publication
FPL Technologies,FPL is on a mission to re-imagine credit and payments from first principles and is building a mobile-first credit card,FinTech
FITTR,Fitness Social Network & Consultation Platform that helps you achieve your Health & Fitness goals.,Fitness startup
Illumnus,"An innovative EdTech startup from IITB & BITS alumni, offering B2B SaaS-based collaborative LMS for Schools and Universities",EdTech Startup
CashKaro,Cashkaro is a coupons and cashback site rewarding customers for visiting online retailers through their site.,E-commerce
Newton School,Newton School is a platform to learn and develop skills,EdTech Startup
Airmeet,"Airmeet is an all-in-one events platform for virtual summits, meetups, and workshops that includes virtual social lounge",Tech Startup
Observe ai,"Observe.AI develops a voice AI platform for contact centers, turning agents into top performers.",Tech
InCred,"Provide loans for all your needs like personal loan for wedding, education loan, business loan",Finance
Toppr,Toppr is an Indian educational technology and online tutoring firm,EdTech
CarTrade,Buy and Sell Used Cars,Car Trade
LEAD School,Offers a high-end digital classroom system focused on enhancing the learning experience,EdtTech
Servify,"Enables top OEMs & ODMs in device distribution, sales, warranty",Manufacturing
Lido Learning,"Online classes for Std 4-9 in Math, Science, Coding, English & Leadership with top 1% tutors ‍",EdTech
Apna.co,Can find all types of jobs from entry level to experienced people in over 60+ categories.,Job portal
Quintype Technologies,"Building a suite of digital publishing solutions to simplify content creation, distribution",Tech
Dunzo,Order online and get free delivery from your nearby restaurants,Tech
Entropik,Gain insights into human emotions with AI-powered platform affect lab.,AI Platform
Livspace,Interior design marketplace that connects interior designers,Home Design
Ultraviolette Automotive,Industries Automotive Electric Vehicle Energy Energy Storage,Automation
WinZO,WinZO is a mobile e-Sports gaming platform in India. It is available in 10 regional languages of India.,Gaming
SenseHawk,SenseHawk is a SaaS platform that helps improve processes and saves cost in the development,Solar SaaS
Railofy,Enables waitlisted passengers to reach their destination at the lowest possible price if their ticket is not,WL & RAC protection
Eloelo,"Social Commerce Venture for Wellness. View company info, jobs, team members, culture, funding and more.",Social commerce
Aibono,A next dimension food & farming platform that unites two ends of the food chain from growing to consuming,AgriTech
BuildPan,"Buildpan helps you with continuous build, development and user feedback for iOS and Android development.",SaaS startup
Homelane,Explore 1000's of fully customizable home interior designs.,Home interior services
MyGlamm,Buy Makeup kit & Cosmetics Products from international makeup brand,Fashion
Aviom,A social impact focused housing finance company catering to housing needs of customers in semi urban areas,Finance
Flinto,Flintobox is an India-based company that produces educational activity boxes for children,EdTech Startup
WayCool,WayCool is a social enterprise positively impacting the lives of India's farmers,Agritech startup
YAP,Create your own stream of Neo-banking and Deposit products using our bank-grade APIs,API platform
Big Bang Boom Solutions,It aims to co-create intellectual property that can reside within the borders of the country.,Deep Tech
GUVI,Operates vernacular-language based education tech startup,EdTech Startup
BluSmart,"BluSmart, an all-electric ride-hailing platform",Electricity
Cell Propulsion,Designs and develops electric power drives and autonomous electric mobility solutions,Automotive company
MPL,Mobile Premier League (also known as MPL) is the mobile e-Sports platform,Entertainment
Spoonshot,A food science company using AI to predict consumer taste and food trends,FMCG
Pulse,Helps people navigate through and profit off financial markets,FinTech
Groww,Leading Investment and Trading Platform,FinTech
i3 Systems,Transforming India's health insurance industry with its digital solutions and AI products for automation,Insurance Tech
SOAL,"A skill-tank nurturing students into disruptive, tech-empowered creators and future leaders",EdTech
OckyPocky,Ockypocky helps kids in learning spoken english,EdTech
Hippo Video,Helps enterprise businesses achieve their marketing and sales goals through seamless video,Video personalization
Hasura,"Builds developer tooling products, including open source tools, backend",Software Company
Qapita,Qapita provides digital equity management tools for private companies and startups.,FinTech
Sunday,An end-to-end insurance products and services provider that uses AI to offer personalized packages.,FinTech
Gamezop,A multi-game platform,Gaming
Phool.co,They use flowers from temples across India's and create useful products such as rose incense cone,Biomaterial startup
